paperId_acm,title_acm,authors_acm,venue_acm,year_acm,cleaned_title_acm,cleaned_authors_acm,index_acm
5390975920f70186a0dfc98a,On validation of XML streams using finite state machines,"Cristiana Chitic, Daniela Rosu",Proceedings of the 7th International Workshop on the Web and Databases: colocated with ACM SIGMOD/PODS 2004,2004,on validation of xml streams using finite state machines,cristiana chitic daniela rosu,141
53908b4920f70186a0dbabcb,The intrinsic problems of structural heterogeneity and an approach to their solution,"Theo H&#228/rder, G&#252/nter Sauter, Joachim Thomas",The VLDB Journal — The International Journal on Very Large Data Bases,1999,the intrinsic problems of structural heterogeneity and an approach to their solution,theo h 228 rder g 252 nter sauter joachim thomas,2574
53908b4920f70186a0dbc508,Complex relationships and knowledge discovery support in the InfoQuilt system,"A. Sheth, S. Thacker, S. Patel",The VLDB Journal — The International Journal on Very Large Data Bases,2003,complex relationships and knowledge discovery support in the infoquilt system,a sheth s thacker s patel,2683
53909f6920f70186a0e3a997,Efficient exploration of large scientific databases,"Etzard Stolte, Gustavo Alonso",VLDB '02 Proceedings of the 28th international conference on Very Large Data Bases,2002,efficient exploration of large scientific databases,etzard stolte gustavo alonso,306
5390881220f70186a0d7f82b,Database research at Arizona State University,"Susan D. Urban, Suzanne W. Dietrich, Forouzan Golshani",ACM SIGMOD Record,1996,database research at arizona state university,susan d urban suzanne w dietrich forouzan golshani,1719
53909f8c20f70186a0e3fe2b,A regression-based temporal pattern mining scheme for data streams,"Wei-Guang Teng, Ming-Syan Chen, Philip S. Yu",VLDB '03 Proceedings of the 29th international conference on Very large data bases - Volume 29,2003,a regression based temporal pattern mining scheme for data streams,wei guang teng ming syan chen philip s yu,393
53909f8c20f70186a0e401d9,An annotation management system for relational databases,"Deepavali Bhagwat, Laura Chiticariu, Wang-Chiew Tan, Gaurav Vijayvargiya",VLDB '04 Proceedings of the Thirtieth international conference on Very large data bases - Volume 30,2004,an annotation management system for relational databases,deepavali bhagwat laura chiticariu wang chiew tan gaurav vijayvargiya,648
539087cf20f70186a0d5d03d,"Opportunities at ARPA, NSF, and elsewhere",Xiaolei Qian,ACM SIGMOD Record,1995,opportunities at arpa nsf and elsewhere,xiaolei qian,725
5390981d20f70186a0e0499c,"Conditional XPath, the first order complete XPath dialect",Maarten Marx,PODS '04 Proceedings of the twenty-third ACM SIGMOD-SIGACT-SIGART symposium on Principles of database systems,2004,conditional xpath the first order complete xpath dialect,maarten marx,239
53908b4920f70186a0dbabc0,Progressive evaluation of nested aggregate queries,"Kian-Lee Tan, Cheng Hian Goh, Beng Chin Ooi",The VLDB Journal — The International Journal on Very Large Data Bases,2000,progressive evaluation of nested aggregate queries,kian lee tan cheng hian goh beng chin ooi,2584
539087d920f70186a0d5ff7b,On-line reorganization of sparsely-populated B+-trees,"Chendong Zou, Betty Salzberg",SIGMOD '96 Proceedings of the 1996 ACM SIGMOD international conference on Management of data,1996,on line reorganization of sparsely populated b trees,chendong zou betty salzberg,848
5390882420f70186a0d8909a,Conjunctive selection conditions in main memory,Kenneth A. Ross,Proceedings of the twenty-first ACM SIGMOD-SIGACT-SIGART symposium on Principles of database systems,2002,conjunctive selection conditions in main memory,kenneth a ross,1757
53909f8c20f70186a0e40220,PLACE: a query processor for handling real-time spatio-temporal data streams,"Mohamed F. Mokbel, Xiaopeng Xiong, Walid G. Aref, Susanne E. Hambrusch, Sunil Prabhakar, Moustafa A. Hammad",VLDB '04 Proceedings of the Thirtieth international conference on Very large data bases - Volume 30,2004,place a query processor for handling real time spatio temporal data streams,mohamed f mokbel xiaopeng xiong walid g aref susanne e hambrusch sunil prabhakar moustafa a hammad,653
53909f8c20f70186a0e3fe5b,BHUNT: automatic discovery of Fuzzy algebraic constraints in relational data,"Paul G. Brown, Peter J. Hass",VLDB '03 Proceedings of the 29th international conference on Very large data bases - Volume 29,2003,bhunt automatic discovery of fuzzy algebraic constraints in relational data,paul g brown peter j hass,436
539087d920f70186a0d60e3a,Accessing information from globally distributed knowledge repositories (extended abstract),Alfred V. Aho,PODS '96 Proceedings of the fifteenth ACM SIGACT-SIGMOD-SIGART symposium on Principles of database systems,1996,accessing information from globally distributed knowledge repositories extended abstract,alfred v aho,890
539087f320f70186a0d6f86f,A comparison of selectivity estimators for range queries on metric attributes,"Björn Blohsfeld, Dieter Korus, Bernhard Seeger",SIGMOD '99 Proceedings of the 1999 ACM SIGMOD international conference on Management of data,1999,a comparison of selectivity estimators for range queries on metric attributes,bj rn blohsfeld dieter korus bernhard seeger,1283
5390882d20f70186a0d8dac4,Mining long sequential patterns in a noisy environment,"Jiong Yang, Wei Wang, Philip S. Yu, Jiawei Han",Proceedings of the 2002 ACM SIGMOD international conference on Management of data,2002,mining long sequential patterns in a noisy environment,jiong yang wei wang philip s yu jiawei han,1813
53908b4920f70186a0dbbf82,Typing and querying XML documents: some complexity bounds,Luc Segoufin,Proceedings of the twenty-second ACM SIGMOD-SIGACT-SIGART symposium on Principles of database systems,2003,typing and querying xml documents some complexity bounds,luc segoufin,2668
53908b4920f70186a0dbab22,Optimizing multiple dimensional queries simultaneously in multidimensional databases,"Weifa Liang, Maria E. Orlowska, Jeffrey X. Yu",The VLDB Journal — The International Journal on Very Large Data Bases,2000,optimizing multiple dimensional queries simultaneously in multidimensional databases,weifa liang maria e orlowska jeffrey x yu,2502
53908a9620f70186a0da47e7,Linking Business to Deliver Value: A Data Management Challenge,Anand Deshpande,VLDB '00 Proceedings of the 26th International Conference on Very Large Data Bases,2000,linking business to deliver value a data management challenge,anand deshpande,2268
539087ef20f70186a0d6c8e1,Report on the 5th international workshop on knowledge representation meets databases (KRDB'98),"Alex Borgida, Vinay K. Chaudhri, Martin Staudt",ACM SIGMOD Record,1998,report on the 5th international workshop on knowledge representation meets databases krdb 98,alex borgida vinay k chaudhri martin staudt,1238
53908b4920f70186a0dbbf8d,Feasible itemset distributions in data mining: theory and application,"Ganesh Ramesh, William A. Maniatty, Mohammed J. Zaki",Proceedings of the twenty-second ACM SIGMOD-SIGACT-SIGART symposium on Principles of database systems,2003,feasible itemset distributions in data mining theory and application,ganesh ramesh william a maniatty mohammed j zaki,2667
539087f320f70186a0d70acf,The OASIS multidatabase prototype,"Mark Roantree, John Murphy, Wilhelm Hasselbring",ACM SIGMOD Record,1999,the oasis multidatabase prototype,mark roantree john murphy wilhelm hasselbring,1404
53908a7420f70186a0da4524,Issues in Developing Very Large Data Warehouses,"Lyman Do, Pamela Drew, Wei Jin, Vish Jumani, David Van Rossum",VLDB '98 Proceedings of the 24rd International Conference on Very Large Data Bases,1998,issues in developing very large data warehouses,lyman do pamela drew wei jin vish jumani david van rossum,2042
558e0bce0cf2e667580509be,Book review column,Karl Aberer,ACM SIGMOD Record,2002,book review column,karl aberer,1735
5390980720f70186a0e03e99,BINOCULAR: a system monitoring framework,"Fatih Emekci, Sezai E. Tuna, Divyakant Agrawal, Amr El Abbadi",DMSN '04 Proceeedings of the 1st international workshop on Data management for sensor networks: in conjunction with VLDB 2004,2004,binocular a system monitoring framework,fatih emekci sezai e tuna divyakant agrawal amr el abbadi,222
5390882d20f70186a0d8dba3,Phoenix project: fault-tolerant applications,"Roger Barga, David Lomet",ACM SIGMOD Record,2002,phoenix project fault tolerant applications,roger barga david lomet,1855
53909f8c20f70186a0e4018d,"Structures, semantics and statistics",Alon Y. Halevy,VLDB '04 Proceedings of the Thirtieth international conference on Very large data bases - Volume 30,2004,structures semantics and statistics,alon y halevy,569
53909f8c20f70186a0e401d4,Voronoi-based K nearest neighbor search for spatial network databases,"Mohammad Kolahdouzan, Cyrus Shahabi",VLDB '04 Proceedings of the Thirtieth international conference on Very large data bases - Volume 30,2004,voronoi based k nearest neighbor search for spatial network databases,mohammad kolahdouzan cyrus shahabi,588
5390881820f70186a0d81114,Supply chain infrastructures: system integration and information sharing,"Michael O. Ball, Meng Ma, Louiqa Raschid, Zhengying Zhao",ACM SIGMOD Record,2002,supply chain infrastructures system integration and information sharing,michael o ball meng ma louiqa raschid zhengying zhao,1741
53908b4920f70186a0dbbf79,The view selection problem for XML content based routing,"Ashish Kumar Gupta, Dan Suciu, Alon Y. Halevy",Proceedings of the twenty-second ACM SIGMOD-SIGACT-SIGART symposium on Principles of database systems,2003,the view selection problem for xml content based routing,ashish kumar gupta dan suciu alon y halevy,2654
5390972920f70186a0dfacbe,Robust query processing through progressive optimization,"Volker Markl, Vijayshankar Raman, David Simmen, Guy Lohman, Hamid Pirahesh, Miso Cilimdzic",SIGMOD '04 Proceedings of the 2004 ACM SIGMOD international conference on Management of data,2004,robust query processing through progressive optimization,volker markl vijayshankar raman david simmen guy lohman hamid pirahesh miso cilimdzic,90
53908a7420f70186a0da4670,XML Repository and Active Views Demonstration,"Serge Abiteboul, Vincent Aguilera, Sébastien Ailleret, Bernd Amann, Sophie Cluet, Brendan Hills, Frédéric Hubert, Jean-Claude Mamou, Amélie Marian, Laurent Mignet, Tova Milo, Cassio Souza dos Santos, Bruno Tessier, Anne-Marie Vercoustre",VLDB '99 Proceedings of the 25th International Conference on Very Large Data Bases,1999,xml repository and active views demonstration,serge abiteboul vincent aguilera s bastien ailleret bernd amann sophie cluet brendan hills fr d ric hubert jean claude mamou am lie marian laurent mignet tova milo cassio souza dos santos bruno tessier anne marie vercoustre,2124
5390881220f70186a0d7e336,Fast-Start: quick fault recovery in oracle,"Tirthankar Lahiri, Amit Ganesh, Ron Weiss, Ashok Joshi",SIGMOD '01 Proceedings of the 2001 ACM SIGMOD international conference on Management of data,2001,fast start quick fault recovery in oracle,tirthankar lahiri amit ganesh ron weiss ashok joshi,1673
5390972920f70186a0dfacec,Querying at Internet scale,"Brent Chun, Joseph M. Hellerstein, Ryan Huebsch, Shawn R. Jeffery, Boon Thau Loo, Sam Mardanbeigi, Timothy Roscoe, Sean Rhea, Scott Shenker, Ion Stoica",SIGMOD '04 Proceedings of the 2004 ACM SIGMOD international conference on Management of data,2004,querying at internet scale,brent chun joseph m hellerstein ryan huebsch shawn r jeffery boon thau loo sam mardanbeigi timothy roscoe sean rhea scott shenker ion stoica,117
53908d6520f70186a0dd1a23,Evaluating probabilistic queries over imprecise data,"Reynold Cheng, Dmitri V. Kalashnikov, Sunil Prabhakar",Proceedings of the 2003 ACM SIGMOD international conference on Management of data,2003,evaluating probabilistic queries over imprecise data,reynold cheng dmitri v kalashnikov sunil prabhakar,2758
53908d6520f70186a0dd1a1e,The design of an acquisitional query processor for sensor networks,"Samuel Madden, Michael J. Franklin, Joseph M. Hellerstein, Wei Hong",Proceedings of the 2003 ACM SIGMOD international conference on Management of data,2003,the design of an acquisitional query processor for sensor networks,samuel madden michael j franklin joseph m hellerstein wei hong,2774
539087e720f70186a0d6967d,Microsoft universal data access platform,"José A. Blakeley, Michael J. Pizzo",SIGMOD '98 Proceedings of the 1998 ACM SIGMOD international conference on Management of data,1998,microsoft universal data access platform,jos a blakeley michael j pizzo,1177
53908a9620f70186a0da4cfa,Estimating the Selectivity of Spatial Queries Using the `Correlation' Fractal Dimension,"Alberto Belussi, Christos Faloutsos",VLDB '95 Proceedings of the 21th International Conference on Very Large Data Bases,1995,estimating the selectivity of spatial queries using the correlation fractal dimension,alberto belussi christos faloutsos,2338
539089bb20f70186a0d98acf,Characterization of database access pattern for analytic prediction of buffer hit probability,"Asit Dan, Philip S. Yu, Jen Yao Chung",The VLDB Journal — The International Journal on Very Large Data Bases,1995,characterization of database access pattern for analytic prediction of buffer hit probability,asit dan philip s yu jen yao chung,1950
53908b4920f70186a0dbbf7a,Computing full disjunctions,"Yaron Kanza, Yehoshua Sagiv",Proceedings of the twenty-second ACM SIGMOD-SIGACT-SIGART symposium on Principles of database systems,2003,computing full disjunctions,yaron kanza yehoshua sagiv,2659
539095ba20f70186a0df166f,Retrieval effectiveness of an ontology-based model for information selection,"Latifur Khan, Dennis McLeod, Eduard Hovy",The VLDB Journal — The International Journal on Very Large Data Bases,2004,retrieval effectiveness of an ontology based model for information selection,latifur khan dennis mcleod eduard hovy,2871
53909f8c20f70186a0e3fe45,Buffering accesses to memory-resident index structures,"Jingren Zhou, Kenneth A. Ross",VLDB '03 Proceedings of the 29th international conference on Very large data bases - Volume 29,2003,buffering accesses to memory resident index structures,jingren zhou kenneth a ross,424
539087f320f70186a0d6f95c,DOMINO: databases fOr MovINg Objects tracking,"Ouri Wolfson, Prasad Sistla, Bo Xu, Jutai Zhou, Sam Chamberlain",SIGMOD '99 Proceedings of the 1999 ACM SIGMOD international conference on Management of data,1999,domino databases for moving objects tracking,ouri wolfson prasad sistla bo xu jutai zhou sam chamberlain,1338
53908d6520f70186a0dd19fe,ViST: a dynamic index method for querying XML data by tree structures,"Haixun Wang, Sanghyun Park, Wei Fan, Philip S. Yu",Proceedings of the 2003 ACM SIGMOD international conference on Management of data,2003,vist a dynamic index method for querying xml data by tree structures,haixun wang sanghyun park wei fan philip s yu,2723
53908b4920f70186a0dbc923,XML schema,"Charles E. Campbell, Andrew Eisenberg, Jim Melton",ACM SIGMOD Record,2003,xml schema,charles e campbell andrew eisenberg jim melton,2699
539087e720f70186a0d68b7a,Where will object technology drive data administration?,Arnon Rosenthal,ACM SIGMOD Record,1998,where will object technology drive data administration,arnon rosenthal,1083
53908b4920f70186a0dbc91a,An approach to confidence based page ranking for user oriented Web search,"Debajyoti Mukhopadhyay, Debasis Giri, Sanasam Ranbir Singh",ACM SIGMOD Record,2003,an approach to confidence based page ranking for user oriented web search,debajyoti mukhopadhyay debasis giri sanasam ranbir singh,2701
539087cf20f70186a0d5b6fb,Finite queries do not have effective syntax,"Alexei P. Stolboushkin, Michael A. Taitslin",PODS '95 Proceedings of the fourteenth ACM SIGACT-SIGMOD-SIGART symposium on Principles of database systems,1995,finite queries do not have effective syntax,alexei p stolboushkin michael a taitslin,710
5390881220f70186a0d7dbee,Towards knowledge-based digital libraries,"Ling Feng, Marfred A. Jeusfeld, Jeroen Hoppenbrouwers",ACM SIGMOD Record,2001,towards knowledge based digital libraries,ling feng marfred a jeusfeld jeroen hoppenbrouwers,1583
5390975920f70186a0dfe2c0,Issues in mechanical engineering design management,"Dave Hislop, Zoé Lacroix, Gerald Moeller",ACM SIGMOD Record,2004,issues in mechanical engineering design management,dave hislop zo lacroix gerald moeller,168
539096cb20f70186a0df7882,Evolutionary techniques for updating query cost models in a dynamic multidatabase environment,"Amira Rahal, Qiang Zhu, Per-Åke Larson",The VLDB Journal — The International Journal on Very Large Data Bases,2004,evolutionary techniques for updating query cost models in a dynamic multidatabase environment,amira rahal qiang zhu per ke larson,2899
53909f8c20f70186a0e4021a,CAPE: continuous query engine with heterogeneous-grained adaptivity,"Elke A. Rundensteiner, Luping Ding, Timothy Sutherland, Yali Zhu, Brad Pielech, Nishant Mehta",VLDB '04 Proceedings of the Thirtieth international conference on Very large data bases - Volume 30,2004,cape continuous query engine with heterogeneous grained adaptivity,elke a rundensteiner luping ding timothy sutherland yali zhu brad pielech nishant mehta,605
539087cf20f70186a0d5b545,Condition handling in SQL persistent stored modules,Jeff Richey,ACM SIGMOD Record,1995,condition handling in sql persistent stored modules,jeff richey,692
5390981d20f70186a0e049b7,Approximate counts and quantiles over sliding windows,"Arvind Arasu, Gurmeet Singh Manku",PODS '04 Proceedings of the twenty-third ACM SIGMOD-SIGACT-SIGART symposium on Principles of database systems,2004,approximate counts and quantiles over sliding windows,arvind arasu gurmeet singh manku,269
5390880d20f70186a0d7b5ec,Comparative analysis of six XML schema languages,"Dongwon Lee, Wesley W. Chu",ACM SIGMOD Record,2000,comparative analysis of six xml schema languages,dongwon lee wesley w chu,1564
539087eb20f70186a0d6a44a,DBSim: a simulation tool for predicting database performance,"Mark Lefler, Mark Stokrp, Craig Wong",SIGMOD '96 Proceedings of the 1996 ACM SIGMOD international conference on Management of data,1996,dbsim a simulation tool for predicting database performance,mark lefler mark stokrp craig wong,1212
539087dd20f70186a0d644db,"Building a scaleable geo-spatial DBMS: technology, implementation, and evaluation","Jignesh Patel, JieBing Yu, Navin Kabra, Kristin Tufte, Biswadeep Nag, Josef Burger, Nancy Hall, Karthikeyan Ramasamy, Roger Lueder, Curt Ellmann, Jim Kupsch, Shelly Guo, Johan Larson, David De Witt, Jeffrey Naughton",SIGMOD '97 Proceedings of the 1997 ACM SIGMOD international conference on Management of data,1997,building a scaleable geo spatial dbms technology implementation and evaluation,jignesh patel jiebing yu navin kabra kristin tufte biswadeep nag josef burger nancy hall karthikeyan ramasamy roger lueder curt ellmann jim kupsch shelly guo johan larson david de witt jeffrey naughton,979
539087e720f70186a0d68b6d,Unbundling active functionality,"Stella Gatziu, Arne Koschel, Günter von Bültzingsloewen, Hans Fritschi",ACM SIGMOD Record,1998,unbundling active functionality,stella gatziu arne koschel g nter von b ltzingsloewen hans fritschi,1077
5390882d20f70186a0d8db9f,Data warehousing and business intelligence for e-commerce: by Alan R. Simon & Steven L. Shaffer,Frank G. Goethals,ACM SIGMOD Record,2002,data warehousing and business intelligence for e commerce by alan r simon steven l shaffer,frank g goethals,1851
53909f8c20f70186a0e401dd,Lifting the burden of history from adaptive query processing,"Amol Deshpande, Joseph M. Hellerstein",VLDB '04 Proceedings of the Thirtieth international conference on Very large data bases - Volume 30,2004,lifting the burden of history from adaptive query processing,amol deshpande joseph m hellerstein,600
53909f8c20f70186a0e3fe3a,Holistic twig joins on indexed XML documents,"Haifeng Jiang, Wei Wang, Hongjun Lu, Jeffrey Xu Yu",VLDB '03 Proceedings of the 29th international conference on Very large data bases - Volume 29,2003,holistic twig joins on indexed xml documents,haifeng jiang wei wang hongjun lu jeffrey xu yu,419
53908a9620f70186a0da4740,Mining Frequent Itemsets Using Support Constraints,"Ke Wang, Yu He, Jiawei Han",VLDB '00 Proceedings of the 26th International Conference on Very Large Data Bases,2000,mining frequent itemsets using support constraints,ke wang yu he jiawei han,2195
5390882d20f70186a0d8daa4,An adaptive peer-to-peer network for distributed caching of OLAP results,"Panos Kalnis, Wee Siong Ng, Beng Chin Ooi, Dimitris Papadias, Kian-Lee Tan",Proceedings of the 2002 ACM SIGMOD international conference on Management of data,2002,an adaptive peer to peer network for distributed caching of olap results,panos kalnis wee siong ng beng chin ooi dimitris papadias kian lee tan,1790
5390972920f70186a0dface9,Load management and high availability in the Medusa distributed stream processing system,"Magdalena Balazinska, Hari Balakrishnan, Michael Stonebraker",SIGMOD '04 Proceedings of the 2004 ACM SIGMOD international conference on Management of data,2004,load management and high availability in the medusa distributed stream processing system,magdalena balazinska hari balakrishnan michael stonebraker,52
5390881220f70186a0d7e36e,Standard for multimedia databases,John R. Smith,SIGMOD '01 Proceedings of the 2001 ACM SIGMOD international conference on Management of data,2001,standard for multimedia databases,john r smith,1685
539087e120f70186a0d668fe,Complete geometrical query languages (extended abstract),"Marc Gyssens, Jan Van den Bussche, Dirk Van Gucht",PODS '97 Proceedings of the sixteenth ACM SIGACT-SIGMOD-SIGART symposium on Principles of database systems,1997,complete geometrical query languages extended abstract,marc gyssens jan van den bussche dirk van gucht,1037
5390962020f70186a0df3f47,Evaluating lock-based protocols for cooperation on XML documents,"Sven Helmer, Carl-Christian Kanne, Guido Moerkotte",ACM SIGMOD Record,2004,evaluating lock based protocols for cooperation on xml documents,sven helmer carl christian kanne guido moerkotte,2884
53908a9620f70186a0da4872,Temporal Queries in OLAP,"Alberto O. Mendelzon, Alejandro A. Vaisman",VLDB '00 Proceedings of the 26th International Conference on Very Large Data Bases,2000,temporal queries in olap,alberto o mendelzon alejandro a vaisman,2259
5390882420f70186a0d890a5,Characterizing memory requirements for queries over continuous data streams,"Arvind Arasu, Brian Babcock, Shivnath Babu, Jon McAlister, Jennifer Widom",Proceedings of the twenty-first ACM SIGMOD-SIGACT-SIGART symposium on Principles of database systems,2002,characterizing memory requirements for queries over continuous data streams,arvind arasu brian babcock shivnath babu jon mcalister jennifer widom,1772
539087e720f70186a0d6969f,SuperSQL: an extended SQL for database publishing and presentation,Motomichi Toyama,SIGMOD '98 Proceedings of the 1998 ACM SIGMOD international conference on Management of data,1998,supersql an extended sql for database publishing and presentation,motomichi toyama,1196
53908a9720f70186a0da68fb,Replication between Geographically Separated Clusters - An Asynchronous Scalable Replication Mechanism for Very High Availability,"Anders Björnerstedt, Helena Ketoja, Johan Sintorn, Martin Sköld",DBTel '01 Proceedings of the VLDB 2001 International Workshop on Databases in Telecommunications II,2001,replication between geographically separated clusters an asynchronous scalable replication mechanism for very high availability,anders bj rnerstedt helena ketoja johan sintorn martin sk ld,2447
539087e720f70186a0d69665,NoDoSE—a tool for semi-automatically extracting structured and semistructured data from text documents,Brad Adelberg,SIGMOD '98 Proceedings of the 1998 ACM SIGMOD international conference on Management of data,1998,nodose a tool for semi automatically extracting structured and semistructured data from text documents,brad adelberg,1169
5390972920f70186a0dfac9d,Approximate XML query answers,"Neoklis Polyzotis, Minos Garofalakis, Yannis Ioannidis",SIGMOD '04 Proceedings of the 2004 ACM SIGMOD international conference on Management of data,2004,approximate xml query answers,neoklis polyzotis minos garofalakis yannis ioannidis,20
5390881220f70186a0d7e35f,Will database researchers have any role in data security? (panel session),"Arnon Rosenthal, Klaus Dittrich, Jim Donahue, Bill Maimone",SIGMOD '01 Proceedings of the 2001 ACM SIGMOD international conference on Management of data,2001,will database researchers have any role in data security panel session,arnon rosenthal klaus dittrich jim donahue bill maimone,1692
539087f320f70186a0d6f860,Fast algorithms for projected clustering,"Charu C. Aggarwal, Joel L. Wolf, Philip S. Yu, Cecilia Procopiuc, Jong Soo Park",SIGMOD '99 Proceedings of the 1999 ACM SIGMOD international conference on Management of data,1999,fast algorithms for projected clustering,charu c aggarwal joel l wolf philip s yu cecilia procopiuc jong soo park,1293
5390881220f70186a0d7e2ad,Optimal and approximate computation of summary statistics for range aggregates,"Anna C. Gilbert, Yannis Kotidis, S. Muthukrishnan, Marin J. Strauss",PODS '01 Proceedings of the twentieth ACM SIGMOD-SIGACT-SIGART symposium on Principles of database systems,2001,optimal and approximate computation of summary statistics for range aggregates,anna c gilbert yannis kotidis s muthukrishnan marin j strauss,1606
539087d920f70186a0d604f6,Scientists called upon to take actions,Xiaolei Qian,ACM SIGMOD Record,1996,scientists called upon to take actions,xiaolei qian,887
53908b4920f70186a0dbbf73,An information-theoretic approach to normal forms for relational and XML data,"Marcelo Arenas, Leonid Libkin",Proceedings of the twenty-second ACM SIGMOD-SIGACT-SIGART symposium on Principles of database systems,2003,an information theoretic approach to normal forms for relational and xml data,marcelo arenas leonid libkin,2657
