paperId_acm,title_acm,authors_acm,venue_acm,year_acm,cleaned_title_acm,cleaned_authors_acm,index_acm
53909f8c20f70186a0e401ed,Indexing XML data stored in a relational database,"Shankar Pal, Istvan Cseri, Oliver Seeliger, Gideon Schaller, Leo Giakoumakis, Vasili Zolotov",VLDB '04 Proceedings of the Thirtieth international conference on Very large data bases - Volume 30,2004,indexing xml data stored in a relational database,shankar pal istvan cseri oliver seeliger gideon schaller leo giakoumakis vasili zolotov,589
53909f8c20f70186a0e3fe93,Efficacious data cube exploration by semantic summarization and compression,"Laks V. S. Lakshmanan, Jian Pei, Yan Zhao",VLDB '03 Proceedings of the 29th international conference on Very large data bases - Volume 29,2003,efficacious data cube exploration by semantic summarization and compression,laks v s lakshmanan jian pei yan zhao,466
539087f320f70186a0d6f7a0,Applications of linear algebra in information retrieval and hypertext analysis,"Jon Kleinberg, Andrew Tomkins",PODS '99 Proceedings of the eighteenth ACM SIGMOD-SIGACT-SIGART symposium on Principles of database systems,1999,applications of linear algebra in information retrieval and hypertext analysis,jon kleinberg andrew tomkins,1252
5390972920f70186a0dfac89,Online event-driven subsequence matching over financial data streams,"Huanmei Wu, Betty Salzberg, Donghui Zhang",SIGMOD '04 Proceedings of the 2004 ACM SIGMOD international conference on Management of data,2004,online event driven subsequence matching over financial data streams,huanmei wu betty salzberg donghui zhang,5
53909f6920f70186a0e3a9b9,"Preference SQL: design, implementation, experiences","Werner Kießling, Gerhard Köstler",VLDB '02 Proceedings of the 28th international conference on Very Large Data Bases,2002,preference sql design implementation experiences,werner kie ling gerhard k stler,341
53908b2a20f70186a0db974a,Objectivity Industrial Exhibit,Objectivity,VLDB '98 Proceedings of the 24rd International Conference on Very Large Data Bases,1998,objectivity industrial exhibit,objectivity,2492
53909f6920f70186a0e3a993,Improving data access of J2EE applications by exploiting asynchronous messaging and caching services,"Samuel Kounev, Alejandro Buchmann",VLDB '02 Proceedings of the 28th international conference on Very Large Data Bases,2002,improving data access of j2ee applications by exploiting asynchronous messaging and caching services,samuel kounev alejandro buchmann,301
53908a9720f70186a0da69fb,Integrated XML Document Management,"Hui-I Hsiao, Joshua Hui, Ning Li, Parag Tijare",Proceedings of the VLDB 2002 Workshop EEXTT and CAiSE 2002 Workshop DTWeb on Efficiency and Effectiveness of XML Tools and Techniques and Data Integration over the Web-Revised Papers,2003,integrated xml document management,hui i hsiao joshua hui ning li parag tijare,2456
53908d6520f70186a0dd1a01,Containment join size estimation: models and methods,"Wei Wang, Haifeng Jiang, Hongjun Lu, Jeffrey Xu Yu",Proceedings of the 2003 ACM SIGMOD international conference on Management of data,2003,containment join size estimation models and methods,wei wang haifeng jiang hongjun lu jeffrey xu yu,2789
5390881220f70186a0d7e333,Orthogonal optimization of subqueries and aggregation,"César Galindo-Legaria, Milind Joshi",SIGMOD '01 Proceedings of the 2001 ACM SIGMOD international conference on Management of data,2001,orthogonal optimization of subqueries and aggregation,c sar galindo legaria milind joshi,1668
539087dd20f70186a0d634a4,Opportunities in information management and assurance,Xiaolei Qian,ACM SIGMOD Record,1997,opportunities in information management and assurance,xiaolei qian,948
53908a9620f70186a0da4e2f,Supporting Periodic Authorizations and Temporal Reasoning in Database Access Control,"Elisa Bertino, Claudio Bettini, Elena Ferrari, Pierangela Samarati",VLDB '96 Proceedings of the 22th International Conference on Very Large Data Bases,1996,supporting periodic authorizations and temporal reasoning in database access control,elisa bertino claudio bettini elena ferrari pierangela samarati,2347
53909f8c20f70186a0e401e9,DB2 design advisor: integrated automatic physical database design,"Daniel C. Zilio, Jun Rao, Sam Lightstone, Guy Lohman, Adam Storm, Christian Garcia-Arellano, Scott Fadden",VLDB '04 Proceedings of the Thirtieth international conference on Very large data bases - Volume 30,2004,db2 design advisor integrated automatic physical database design,daniel c zilio jun rao sam lightstone guy lohman adam storm christian garcia arellano scott fadden,641
53908a9620f70186a0da4d94,Effective & Efficient Document Ranking without using a Large Lexicon,Yasushi Ogawa,VLDB '96 Proceedings of the 22th International Conference on Very Large Data Bases,1996,effective efficient document ranking without using a large lexicon,yasushi ogawa,2376
539087ef20f70186a0d6c8e6,The TriGS active object-oriented database system— an overview,"G. Kappel, W. Retschitzegger",ACM SIGMOD Record,1998,the trigs active object oriented database system an overview,g kappel w retschitzegger,1233
53908a9620f70186a0da4876,What Happens During a Join? Dissecting CPU and Memory Optimization Effects,"Stefan Manegold, Peter A. Boncz, Martin L. Kersten",VLDB '00 Proceedings of the 26th International Conference on Very Large Data Bases,2000,what happens during a join dissecting cpu and memory optimization effects,stefan manegold peter a boncz martin l kersten,2250
53908d6520f70186a0dd1a0f,Robust and efficient fuzzy match for online data cleaning,"Surajit Chaudhuri, Kris Ganjam, Venkatesh Ganti, Rajeev Motwani",Proceedings of the 2003 ACM SIGMOD international conference on Management of data,2003,robust and efficient fuzzy match for online data cleaning,surajit chaudhuri kris ganjam venkatesh ganti rajeev motwani,2728
539087dd20f70186a0d62b3c,The aggregate data problem: a system for their definition and management,"M. Rafanelli, A. Bezenchek, L. Tininini",ACM SIGMOD Record,1996,the aggregate data problem a system for their definition and management,m rafanelli a bezenchek l tininini,918
5590ce580cf237666fc28d54,Book review column,Karl Aberer,ACM SIGMOD Record,2002,book review column,karl aberer,1896
53908b2a20f70186a0db9744,Performance of Future Database Systems: Bottlenecks and Bonananzas,Chaitanya K. Baru,VLDB '96 Proceedings of the 22th International Conference on Very Large Data Bases,1996,performance of future database systems bottlenecks and bonananzas,chaitanya k baru,2485
53908d6520f70186a0dd1a33,Transparent mid-tier database caching in SQL server,"Per-Åke Larson, Jonathan Goldstein, Jingren Zhou",Proceedings of the 2003 ACM SIGMOD international conference on Management of data,2003,transparent mid tier database caching in sql server,per ke larson jonathan goldstein jingren zhou,2751
539087f320f70186a0d6f7a6,Substring selectivity estimation,"H. V. Jagadish, Raymond T. Ng, Divesh Srivastava",PODS '99 Proceedings of the eighteenth ACM SIGMOD-SIGACT-SIGART symposium on Principles of database systems,1999,substring selectivity estimation,h v jagadish raymond t ng divesh srivastava,1254
539087e120f70186a0d668fd,Managing semantic heterogeneity in databases: a theoretical prospective,Richard Hull,PODS '97 Proceedings of the sixteenth ACM SIGACT-SIGMOD-SIGART symposium on Principles of database systems,1997,managing semantic heterogeneity in databases a theoretical prospective,richard hull,1039
5390880220f70186a0d76301,Integrating replacement policies in StorM: an extensible approach,"Chong Leng Goh, Beng Chin Ooi, Stephane Bressan, Kian-Lee Tan",SIGMOD '00 Proceedings of the 2000 ACM SIGMOD international conference on Management of data,2000,integrating replacement policies in storm an extensible approach,chong leng goh beng chin ooi stephane bressan kian lee tan,1520
5390880220f70186a0d77f91,Practical lessons in supporting large-scale computational science,"Ron Musick, Terence Critchlow",ACM SIGMOD Record,1999,practical lessons in supporting large scale computational science,ron musick terence critchlow,1547
53908d6520f70186a0dd1a49,Data grid management systems,"Arun Jagatheesan, Arcot Rajasekar",Proceedings of the 2003 ACM SIGMOD international conference on Management of data,2003,data grid management systems,arun jagatheesan arcot rajasekar,2766
539087f320f70186a0d6f891,DataBlitz storage manager: main-memory database performance for critical applications,"J. Baulier, P. Bohannon, S. Gogate, C. Gupta, S. Haldar",SIGMOD '99 Proceedings of the 1999 ACM SIGMOD international conference on Management of data,1999,datablitz storage manager main memory database performance for critical applications,j baulier p bohannon s gogate c gupta s haldar,1343
53908b4920f70186a0dbac69,Join algorithm costs revisited,"Evan P. Harris, Kotagiri Ramamohanarao",The VLDB Journal — The International Journal on Very Large Data Bases,1996,join algorithm costs revisited,evan p harris kotagiri ramamohanarao,2595
5390962020f70186a0df3f42,QUASAR: quality aware sensing architecture,"Iosif Lazaridis, Qi Han, Xingbo Yu, Sharad Mehrotra, Nalini Venkatasubramanian, Dmitri V. Kalashnikov, Weiwen Yang",ACM SIGMOD Record,2004,quasar quality aware sensing architecture,iosif lazaridis qi han xingbo yu sharad mehrotra nalini venkatasubramanian dmitri v kalashnikov weiwen yang,2876
5390882d20f70186a0d8daea,XBase: making your gigabyte disk queriable,"Hongjun Lu, Guoren Wang, Ge Yu, Yubin Bao, Jianhua Lv, Yaxin Yu",Proceedings of the 2002 ACM SIGMOD international conference on Management of data,2002,xbase making your gigabyte disk queriable,hongjun lu guoren wang ge yu yubin bao jianhua lv yaxin yu,1832
539087f320f70186a0d6f874,An adaptive query execution system for data integration,"Zachary G. Ives, Daniela Florescu, Marc Friedman, Alon Levy, Daniel S. Weld",SIGMOD '99 Proceedings of the 1999 ACM SIGMOD international conference on Management of data,1999,an adaptive query execution system for data integration,zachary g ives daniela florescu marc friedman alon levy daniel s weld,1344
5390881220f70186a0d7e325,"StorHouse metanoia - new applications for database, storage & data warehousing","Felipe Cariño, Jr., Pekka Kostamaa, Art Kaufmann, John Burgess",SIGMOD '01 Proceedings of the 2001 ACM SIGMOD international conference on Management of data,2001,storhouse metanoia new applications for database storage data warehousing,felipe cari o jr pekka kostamaa art kaufmann john burgess,1677
5390882d20f70186a0d8daed,Going public: open-source databases and database research,Philippe Bonnet,Proceedings of the 2002 ACM SIGMOD international conference on Management of data,2002,going public open source databases and database research,philippe bonnet,1834
53909f8c20f70186a0e401e5,Generating thousand benchmark queries in seconds,"Meikel Poess, John M. Stephens, Jr.",VLDB '04 Proceedings of the Thirtieth international conference on Very large data bases - Volume 30,2004,generating thousand benchmark queries in seconds,meikel poess john m stephens jr,580
539087dd20f70186a0d64493,Highly concurrent cache consistency for indices in client-server database systems,"Markos Zaharioudakis, Michael J. Carey",SIGMOD '97 Proceedings of the 1997 ACM SIGMOD international conference on Management of data,1997,highly concurrent cache consistency for indices in client server database systems,markos zaharioudakis michael j carey,965
53908a7420f70186a0da447a,Optimizing Queries Across Diverse Data Sources,"Laura M. Haas, Donald Kossmann, Edward L. Wimmers, Jun Yang",VLDB '97 Proceedings of the 23rd International Conference on Very Large Data Bases,1997,optimizing queries across diverse data sources,laura m haas donald kossmann edward l wimmers jun yang,2018
53909f6920f70186a0e3a99b,Discover: keyword search in relational databases,"Vagelis Hristidis, Yannis Papakonstantinou",VLDB '02 Proceedings of the 28th international conference on Very Large Data Bases,2002,discover keyword search in relational databases,vagelis hristidis yannis papakonstantinou,318
539087dd20f70186a0d644ab,InfoSleuth: agent-based semantic integration of information in open and dynamic environments,"R. J. Bayardo, Jr., W. Bohrer, R. Brice, A. Cichocki, J. Fowler, A. Helal, V. Kashyap, T. Ksiezyk, G. Martin, M. Nodine, M. Rashid, M. Rusinkiewicz, R. Shea, C. Unnikrishnan, A. Unruh, D. Woelk",SIGMOD '97 Proceedings of the 1997 ACM SIGMOD international conference on Management of data,1997,infosleuth agent based semantic integration of information in open and dynamic environments,r j bayardo jr w bohrer r brice a cichocki j fowler a helal v kashyap t ksiezyk g martin m nodine m rashid m rusinkiewicz r shea c unnikrishnan a unruh d woelk,972
53908b4920f70186a0dbabc6,Deadlock detection in distributed database systems: a new algorithm and a comparative performance analysis,"Natalija Krivokapi&#263/, Alfons Kemper, Ehud Gudes",The VLDB Journal — The International Journal on Very Large Data Bases,1999,deadlock detection in distributed database systems a new algorithm and a comparative performance analysis,natalija krivokapi 263 alfons kemper ehud gudes,2578
539087e120f70186a0d66912,Processing queries by linear constraints,"Jonathan Goldstein, Raghu Ramakrishnan, Uri Shaft, Jie-Bing Yu",PODS '97 Proceedings of the sixteenth ACM SIGACT-SIGMOD-SIGART symposium on Principles of database systems,1997,processing queries by linear constraints,jonathan goldstein raghu ramakrishnan uri shaft jie bing yu,1054
5390972920f70186a0dfacf8,Tools for design of composite Web services,"Richard Hull, Jianwen Su",SIGMOD '04 Proceedings of the 2004 ACM SIGMOD international conference on Management of data,2004,tools for design of composite web services,richard hull jianwen su,105
53909f8c20f70186a0e3fe43,VIPAS: virtual link powered authority search in the web,"Chi-Chun Lin, Ming-Syan Chen",VLDB '03 Proceedings of the 29th international conference on Very large data bases - Volume 29,2003,vipas virtual link powered authority search in the web,chi chun lin ming syan chen,398
539087cf20f70186a0d5d025,Digital library services in mobile computing,"Bharat Bhargava, Melliyal Annamalai, Evaggelia Pitoura",ACM SIGMOD Record,1995,digital library services in mobile computing,bharat bhargava melliyal annamalai evaggelia pitoura,719
539087dd20f70186a0d6349e,"\"A consumer viewpoint on \"\"Mediator languages—a proposal for a standard\"\"\"","Arnon Rosenthal, Erich Hughes, Scott Renner, Len Seligman",ACM SIGMOD Record,1997,a consumer viewpoint on mediator languages a proposal for a standard,arnon rosenthal erich hughes scott renner len seligman,941
539087d920f70186a0d604eb,Guidelines for presentation and comparison of indexing techniques,"Justin Zobel, Alistair Moffat, Kotagiri Ramamohanarao",ACM SIGMOD Record,1996,guidelines for presentation and comparison of indexing techniques,justin zobel alistair moffat kotagiri ramamohanarao,883
53909f8c20f70186a0e3fe6a,Efficient IR-style keyword search over relational databases,"Vagelis Hristidis, Luis Gravano, Yannis Papakonstantinou",VLDB '03 Proceedings of the 29th international conference on Very large data bases - Volume 29,2003,efficient ir style keyword search over relational databases,vagelis hristidis luis gravano yannis papakonstantinou,481
5390972920f70186a0dface3,Liquid data for WebLogic: integrating enterprise data and services,Vinayak Borkar,SIGMOD '04 Proceedings of the 2004 ACM SIGMOD international conference on Management of data,2004,liquid data for weblogic integrating enterprise data and services,vinayak borkar,64
53908a7420f70186a0da45d9,Proximity Search in Databases,"Roy Goldman, Narayanan Shivakumar, Suresh Venkatasubramanian, Hector Garcia-Molina",VLDB '98 Proceedings of the 24rd International Conference on Very Large Data Bases,1998,proximity search in databases,roy goldman narayanan shivakumar suresh venkatasubramanian hector garcia molina,2107
5390881220f70186a0d7e29f,Representing and querying XML with incomplete information,"Serge Abiteboul, Luc Segoufin, Victor Vianu",PODS '01 Proceedings of the twentieth ACM SIGMOD-SIGACT-SIGART symposium on Principles of database systems,2001,representing and querying xml with incomplete information,serge abiteboul luc segoufin victor vianu,1600
53909f8c20f70186a0e3fe49,Data bubbles for non-vector data: speeding-up hierarchical clustering in arbitrary metric spaces,"Jianjun Zhou, Jörg Sander",VLDB '03 Proceedings of the 29th international conference on Very large data bases - Volume 29,2003,data bubbles for non vector data speeding up hierarchical clustering in arbitrary metric spaces,jianjun zhou j rg sander,402
539087fe20f70186a0d75e49,On Herbrand semantics and conflict serializability of read-write transactions (extended abstract),"Jens Lechtenbörger, Gottfried Vossen",PODS '00 Proceedings of the nineteenth ACM SIGMOD-SIGACT-SIGART symposium on Principles of database systems,2000,on herbrand semantics and conflict serializability of read write transactions extended abstract,jens lechtenb rger gottfried vossen,1425
53908a9620f70186a0da4edf,Efficient Construction of Regression Trees with Range and Region Splitting,"Yasuhiko Morimoto, Hiromu Ishii, Shinichi Morishita",VLDB '97 Proceedings of the 23rd International Conference on Very Large Data Bases,1997,efficient construction of regression trees with range and region splitting,yasuhiko morimoto hiromu ishii shinichi morishita,2401
53909f6920f70186a0e3a998,Searching on the secondary structure of protein sequences,"Laurie Hammel, Jignesh M. Patel",VLDB '02 Proceedings of the 28th international conference on Very Large Data Bases,2002,searching on the secondary structure of protein sequences,laurie hammel jignesh m patel,303
539089ab20f70186a0d96af8,Automata theory for XML researchers,Frank Neven,ACM SIGMOD Record,2002,automata theory for xml researchers,frank neven,1892
53909f6920f70186a0e3a9ad,Business process cockpit,"Mehmet Sayal, Fabio Casati, Umeshwar Dayal, Ming-Chien Shan",VLDB '02 Proceedings of the 28th international conference on Very Large Data Bases,2002,business process cockpit,mehmet sayal fabio casati umeshwar dayal ming chien shan,329
53909f6920f70186a0e3a990,A bandwidth model for internet search,Axel Uhl,VLDB '02 Proceedings of the 28th international conference on Very Large Data Bases,2002,a bandwidth model for internet search,axel uhl,371
539087f320f70186a0d6f792,Processing and optimization of multiway spatial joins using R-trees,"Dimitris Papadias, Nikos Mamoulis, Yannis Theodoridis",PODS '99 Proceedings of the eighteenth ACM SIGMOD-SIGACT-SIGART symposium on Principles of database systems,1999,processing and optimization of multiway spatial joins using r trees,dimitris papadias nikos mamoulis yannis theodoridis,1270
558cfb4ee4b0b692772c9e49,ACM SIGMOD Record,Michael Franklin,ACM SIGMOD Record,1996,acm sigmod record,michael franklin,917
5390882d20f70186a0d8daa7,Processing complex aggregate queries over data streams,"Alin Dobra, Minos Garofalakis, Johannes Gehrke, Rajeev Rastogi",Proceedings of the 2002 ACM SIGMOD international conference on Management of data,2002,processing complex aggregate queries over data streams,alin dobra minos garofalakis johannes gehrke rajeev rastogi,1842
539087e720f70186a0d69654,Efficiently mining long patterns from databases,"Roberto J. Bayardo, Jr.",SIGMOD '98 Proceedings of the 1998 ACM SIGMOD international conference on Management of data,1998,efficiently mining long patterns from databases,roberto j bayardo jr,1129
53908d6520f70186a0dd1a37,STREAM: the stanford stream data manager (demonstration description),"Arvind Arasu, Brian Babcock, Shivnath Babu, Mayur Datar, Keith Ito, Itaru Nishizawa, Justin Rosenstein, Jennifer Widom",Proceedings of the 2003 ACM SIGMOD international conference on Management of data,2003,stream the stanford stream data manager demonstration description,arvind arasu brian babcock shivnath babu mayur datar keith ito itaru nishizawa justin rosenstein jennifer widom,2760
5390972920f70186a0dfafa6,Privacy-preserving data integration and sharing,"Chris Clifton, Murat Kantarcioǧlu, AnHai Doan, Gunther Schadow, Jaideep Vaidya, Ahmed Elmagarmid, Dan Suciu",Proceedings of the 9th ACM SIGMOD workshop on Research issues in data mining and knowledge discovery,2004,privacy preserving data integration and sharing,chris clifton murat kantarcio lu anhai doan gunther schadow jaideep vaidya ahmed elmagarmid dan suciu,124
539087cf20f70186a0d5b6e3,Dense-order constraint databases (extended abstract),"Stéphane Grumbach, Jianwen Su",PODS '95 Proceedings of the fourteenth ACM SIGACT-SIGMOD-SIGART symposium on Principles of database systems,1995,dense order constraint databases extended abstract,st phane grumbach jianwen su,702
558d15440cf2b0acc6504242,The VLDB Journal — The International Journal on Very Large Data Bases,"",The VLDB Journal — The International Journal on Very Large Data Bases,2002,the vldb journal the international journal on very large data bases,"",2623
5390981d20f70186a0e049b5,Flexible time management in data stream systems,"Utkarsh Srivastava, Jennifer Widom",PODS '04 Proceedings of the twenty-third ACM SIGMOD-SIGACT-SIGART symposium on Principles of database systems,2004,flexible time management in data stream systems,utkarsh srivastava jennifer widom,268
53908a9620f70186a0da4e49,Intra-Transaction Parallelism in the Mapping of an Object Model to a Relational Multi-Processor System,"Michael Rys, Moira C. Norrie, Hans-Jörg Schek",VLDB '96 Proceedings of the 22th International Conference on Very Large Data Bases,1996,intra transaction parallelism in the mapping of an object model to a relational multi processor system,michael rys moira c norrie hans j rg schek,2366
53909f6920f70186a0e3a9c1,SELF-SERV: a platform for rapid composition of web services in a peer-to-peer environment,"Quan Z. Sheng, Boualem Benatallah, Marlon Dumas, Eileen Oi-Yan Mak",VLDB '02 Proceedings of the 28th international conference on Very Large Data Bases,2002,self serv a platform for rapid composition of web services in a peer to peer environment,quan z sheng boualem benatallah marlon dumas eileen oi yan mak,358
5390881220f70186a0d7e2a6,"Robbers, marshals, and guards: game theoretic and logical characterizations of hypertree width","Georg Gottlob, Nicola Leone, Francesco Scarcello",PODS '01 Proceedings of the twentieth ACM SIGMOD-SIGACT-SIGART symposium on Principles of database systems,2001,robbers marshals and guards game theoretic and logical characterizations of hypertree width,georg gottlob nicola leone francesco scarcello,1660
53908d6520f70186a0dd1a42,PLASTIC: reducing query optimization overheads through plan recycling,"Vibhuti S. Sengar, Jayant R. Haritsa",Proceedings of the 2003 ACM SIGMOD international conference on Management of data,2003,plastic reducing query optimization overheads through plan recycling,vibhuti s sengar jayant r haritsa,2759
539087f320f70186a0d70ac9,Agent-based semantic interoperability in infosleuth,"Jerry Fowler, Brad Perry, Marian Nodine, Bruce Bargmeyer",ACM SIGMOD Record,1999,agent based semantic interoperability in infosleuth,jerry fowler brad perry marian nodine bruce bargmeyer,1396
5390880d20f70186a0d7b09e,Querying spatial databases via topological invariants,"Luc Segoufin, Victor Vianu",Journal of Computer and System Sciences - Special issue on the seventeenth ACM SIGACT-SIGMOD-SIGART symposium on principles of database systems,2000,querying spatial databases via topological invariants,luc segoufin victor vianu,1551
539087dd20f70186a0d6349a,UIS-management of data and services in the environmental information systems of Baden-Württemberg,"Wolf-Fritz Riekert, Roland Mayer-Föll, Gerlinde Wiest",ACM SIGMOD Record,1997,uis management of data and services in the environmental information systems of baden w rttemberg,wolf fritz riekert roland mayer f ll gerlinde wiest,937
539087e120f70186a0d66911,On the analysis of indexing schemes,"Joseph M. Hellerstein, Elias Koutsoupias, Christos H. Papadimitriou",PODS '97 Proceedings of the sixteenth ACM SIGACT-SIGMOD-SIGART symposium on Principles of database systems,1997,on the analysis of indexing schemes,joseph m hellerstein elias koutsoupias christos h papadimitriou,1053
53908a7420f70186a0da4480,Mining Insurance Data at Swiss Life,"Jörg-Uwe Kietz, Ulrich Reimer, Martin Staudt",VLDB '97 Proceedings of the 23rd International Conference on Very Large Data Bases,1997,mining insurance data at swiss life,j rg uwe kietz ulrich reimer martin staudt,2000
539087f320f70186a0d6f95e,Evolvable view environment (EVE): non-equivalent view maintenance under schema changes,"E. A. Rundensteiner, A. Koeller, X. Zhang, A. J. Lee, A. Nica, A. Van Wyk, Y. Lee",SIGMOD '99 Proceedings of the 1999 ACM SIGMOD international conference on Management of data,1999,evolvable view environment eve non equivalent view maintenance under schema changes,e a rundensteiner a koeller x zhang a j lee a nica a van wyk y lee,1329
539087f320f70186a0d6f86d,An efficient bitmap encoding scheme for selection queries,"Chee-Yong Chan, Yannis E. Ioannidis",SIGMOD '99 Proceedings of the 1999 ACM SIGMOD international conference on Management of data,1999,an efficient bitmap encoding scheme for selection queries,chee yong chan yannis e ioannidis,1299
539087e720f70186a0d6967f,SQL open heterogeneous data access,"Berthold Reinwald, Hamid Pirahesh",SIGMOD '98 Proceedings of the 1998 ACM SIGMOD international conference on Management of data,1998,sql open heterogeneous data access,berthold reinwald hamid pirahesh,1173
5390958920f70186a0deec73,Journal relevance,Richard Snodgrass,ACM SIGMOD Record,2003,journal relevance,richard snodgrass,2821
