paperId_acm,title_acm,authors_acm,venue_acm,year_acm,cleaned_title_acm,cleaned_authors_acm,index_acm
5390972920f70186a0dfacbd,CORDS: automatic discovery of correlations and soft functional dependencies,"Ihab F. Ilyas, Volker Markl, Peter Haas, Paul Brown, Ashraf Aboulnaga",SIGMOD '04 Proceedings of the 2004 ACM SIGMOD international conference on Management of data,2004,cords automatic discovery of correlations and soft functional dependencies,ihab f ilyas volker markl peter haas paul brown ashraf aboulnaga,89
539089d320f70186a0d9c220,Amicalola report: database and information systems research challenges and opportunities in semantic web and enterprises,"Amit Sheth, Robert Meersman",ACM SIGMOD Record,2002,amicalola report database and information systems research challenges and opportunities in semantic web and enterprises,amit sheth robert meersman,1960
5390881220f70186a0d7e31c,Applying the golden rule of sampling for query estimation,"Yi-Leh Wu, Divyakant Agrawal, Amr El Abbadi",SIGMOD '01 Proceedings of the 2001 ACM SIGMOD international conference on Management of data,2001,applying the golden rule of sampling for query estimation,yi leh wu divyakant agrawal amr el abbadi,1638
53909f8c20f70186a0e3fe81,Xcerpt and visXcerpt: from pattern-based to visual querying of XML and semistructured data,"Sacha Berger, François Bry, Sebastian Schaffert, Christoph Wieser",VLDB '03 Proceedings of the 29th international conference on Very large data bases - Volume 29,2003,xcerpt and visxcerpt from pattern based to visual querying of xml and semistructured data,sacha berger fran ois bry sebastian schaffert christoph wieser,457
53908a9620f70186a0da4729,"Ordering Information, Conference Organizers, Program Committees, Additional Reviewers, Additional Demonstrations Reviewers, Sponsors, VLDB Endowment, Preface, Foreword","",VLDB '00 Proceedings of the 26th International Conference on Very Large Data Bases,2000,ordering information conference organizers program committees additional reviewers additional demonstrations reviewers sponsors vldb endowment preface foreword,"",2172
5390979920f70186a0e00cd3,Retrospective on Aurora,"Hari Balakrishnan, Magdalena Balazinska, Don Carney, Uğur Çetintemel, Mitch Cherniack, Christian Convey, Eddie Galvez, Jon Salz, Michael Stonebraker, Nesime Tatbul, Richard Tibbetts, Stan Zdonik",The VLDB Journal — The International Journal on Very Large Data Bases,2004,retrospective on aurora,hari balakrishnan magdalena balazinska don carney u ur etintemel mitch cherniack christian convey eddie galvez jon salz michael stonebraker nesime tatbul richard tibbetts stan zdonik,199
5390972920f70186a0dfac8c,Efficient processing of XML twig queries with OR-predicates,"Haifeng Jiang, Hongjun Lu, Wei Wang",SIGMOD '04 Proceedings of the 2004 ACM SIGMOD international conference on Management of data,2004,efficient processing of xml twig queries with or predicates,haifeng jiang hongjun lu wei wang,50
539087d920f70186a0d5ff87,Spatial hash-joins,"Ming-Ling Lo, Chinya V. Ravishankar",SIGMOD '96 Proceedings of the 1996 ACM SIGMOD international conference on Management of data,1996,spatial hash joins,ming ling lo chinya v ravishankar,857
53909f8c20f70186a0e3fe58,Temporal slicing in the evaluation of XML queries,"Dengfeng Gao, Richard T. Snodgrass",VLDB '03 Proceedings of the 29th international conference on Very large data bases - Volume 29,2003,temporal slicing in the evaluation of xml queries,dengfeng gao richard t snodgrass,435
539087d420f70186a0d5df18,Adaptive parallel aggregation algorithms,"Ambuj Shatdal, Jeffrey F. Naughton",SIGMOD '95 Proceedings of the 1995 ACM SIGMOD international conference on Management of data,1995,adaptive parallel aggregation algorithms,ambuj shatdal jeffrey f naughton,749
539089ab20f70186a0d96af5,A study on the management of semantic transaction for efficient data retrieval,"Shi Ming Huang, Irene Kwan, Chih He Li",ACM SIGMOD Record,2002,a study on the management of semantic transaction for efficient data retrieval,shi ming huang irene kwan chih he li,1885
539087d920f70186a0d5ff8f,Safe and efficient sharing of persistent objects in Thor,"B. Liskov, A. Adya, M. Castro, S. Ghemawat, R. Gruber, U. Maheshwari, A. C. Myers, M. Day, L. Shrira",SIGMOD '96 Proceedings of the 1996 ACM SIGMOD international conference on Management of data,1996,safe and efficient sharing of persistent objects in thor,b liskov a adya m castro s ghemawat r gruber u maheshwari a c myers m day l shrira,851
53908a4020f70186a0d9d773,A multi-paradigm querying approach for a generic multimedia database management system,"Ji-Rong Wen, Qing Li, Wei-Ying Ma, Hong-Jiang Zhang",ACM SIGMOD Record,2003,a multi paradigm querying approach for a generic multimedia database management system,ji rong wen qing li wei ying ma hong jiang zhang,1983
5390880220f70186a0d75edb,High speed on-line backup when using logical log operations,David B. Lomet,SIGMOD '00 Proceedings of the 2000 ACM SIGMOD international conference on Management of data,2000,high speed on line backup when using logical log operations,david b lomet,1444
5390882d20f70186a0d8dace,Garlic: a new flavor of federated query processing for DB2,"Vanja Josifovski, Peter Schwarz, Laura Haas, Eileen Lin",Proceedings of the 2002 ACM SIGMOD international conference on Management of data,2002,garlic a new flavor of federated query processing for db2,vanja josifovski peter schwarz laura haas eileen lin,1817
53909f8c20f70186a0e3fe44,Balancing performance and data freshness in web database servers,"Alexandros Labrinidis, Nick Roussopoulos",VLDB '03 Proceedings of the 29th international conference on Very large data bases - Volume 29,2003,balancing performance and data freshness in web database servers,alexandros labrinidis nick roussopoulos,401
53908a9620f70186a0da47ee,Approximating Aggregate Queries about Web Pages via Random Walks,"Ziv Bar-Yossef, Alexander Berg, Steve Chien, Jittat Fakcharoenphol, Dror Weitz",VLDB '00 Proceedings of the 26th International Conference on Very Large Data Bases,2000,approximating aggregate queries about web pages via random walks,ziv bar yossef alexander berg steve chien jittat fakcharoenphol dror weitz,2236
53908a9620f70186a0da4eca,Database Management Systems and the Internet,Susan Malaika,VLDB '96 Proceedings of the 22th International Conference on Very Large Data Bases,1996,database management systems and the internet,susan malaika,2381
539087d420f70186a0d5df59,Research and products—are they relevant to each other? (panel session),Herb Edelstein,SIGMOD '95 Proceedings of the 1995 ACM SIGMOD international conference on Management of data,1995,research and products are they relevant to each other panel session,herb edelstein,802
539095ba20f70186a0df166e,Algorithms and applications for answering ranked queries using ranked views,"Vagelis Hristidis, Yannis Papakonstantinou",The VLDB Journal — The International Journal on Very Large Data Bases,2004,algorithms and applications for answering ranked queries using ranked views,vagelis hristidis yannis papakonstantinou,2874
539089ab20f70186a0d96f5f,Data analysis and mining in the life sciences,Nam Huyn,ACM SIGMOD Record,2001,data analysis and mining in the life sciences,nam huyn,1900
53908b4920f70186a0dbab16,Efficient filtering of XML documents with XPath expressions,"C.-Y. Chan, P. Felber, M. Garofalakis, R. Rastogi",The VLDB Journal — The International Journal on Very Large Data Bases,2002,efficient filtering of xml documents with xpath expressions,c y chan p felber m garofalakis r rastogi,2510
53909f6920f70186a0e3a9ab,Toward recovery-oriented computing,Armando Fox,VLDB '02 Proceedings of the 28th international conference on Very Large Data Bases,2002,toward recovery oriented computing,armando fox,324
5390882d20f70186a0d8dab7,A scalable hash ripple join algorithm,"Gang Luo, Curt J. Ellmann, Peter J. Haas, Jeffrey F. Naughton",Proceedings of the 2002 ACM SIGMOD international conference on Management of data,2002,a scalable hash ripple join algorithm,gang luo curt j ellmann peter j haas jeffrey f naughton,1793
539087fe20f70186a0d758e8,Database research at the University of Oklahoma,"Le Gruenwald, Leonard Brown, Ravi Dirckze, Sylvain Guinepain, Carlos Sanchez, Brian Summers, Sirirut Vanichayobon",ACM SIGMOD Record,1999,database research at the university of oklahoma,le gruenwald leonard brown ravi dirckze sylvain guinepain carlos sanchez brian summers sirirut vanichayobon,1410
53908b4920f70186a0dbabb7,UnQL: a query language and algebra for semistructured data based on structural recursion,"Peter Buneman, Mary Fernandez, Dan Suciu",The VLDB Journal — The International Journal on Very Large Data Bases,2000,unql a query language and algebra for semistructured data based on structural recursion,peter buneman mary fernandez dan suciu,2582
53909f8c20f70186a0e3fe59,The generalized pre-grouping transformation: aggregate-query optimization in the presence of dependencies,"Aris Tsois, Timos Sellis",VLDB '03 Proceedings of the 29th international conference on Very large data bases - Volume 29,2003,the generalized pre grouping transformation aggregate query optimization in the presence of dependencies,aris tsois timos sellis,432
53909f8c20f70186a0e3fe8a,"NexusScout: an advanced location-based application on a distributed, open mediation platform","Daniela Nicklas, Matthias Grossmann, Thomas Schwarz",VLDB '03 Proceedings of the 29th international conference on Very large data bases - Volume 29,2003,nexusscout an advanced location based application on a distributed open mediation platform,daniela nicklas matthias grossmann thomas schwarz,458
53908a9620f70186a0da47cb,"High-Performance and Scalability through Application Tier,In-Memory Data Management","",VLDB '00 Proceedings of the 26th International Conference on Very Large Data Bases,2000,high performance and scalability through application tier in memory data management,"",2211
53909f8c20f70186a0e3fe71,Data compression in Oracle,"Meikel Poess, Dmitry Potapov",VLDB '03 Proceedings of the 29th international conference on Very large data bases - Volume 29,2003,data compression in oracle,meikel poess dmitry potapov,444
5390882d20f70186a0d8daeb,XmdvTool: visual interactive data exploration and trend discovery of high-dimensional data sets,"Elke A. Rundensteiner, Matthew O. Ward, Jing Yang, Punit R. Doshi",Proceedings of the 2002 ACM SIGMOD international conference on Management of data,2002,xmdvtool visual interactive data exploration and trend discovery of high dimensional data sets,elke a rundensteiner matthew o ward jing yang punit r doshi,1862
5390881220f70186a0d7e2e1,Proceedings of the 2001 ACM SIGMOD international conference on Management of data,"Timos Sellis, Sharad Mehrotra",ACM SIGMOD International Conference on Management of Data,2001,proceedings of the 2001 acm sigmod international conference on management of data,timos sellis sharad mehrotra,1613
539087dd20f70186a0d6349b,Data management for earth system science,"James Frew, Jeff Dozier",ACM SIGMOD Record,1997,data management for earth system science,james frew jeff dozier,938
5390981d20f70186a0e049af,Weighted hypertree decompositions and optimal query plans,"Francesco Scarcello, Gianluigi Greco, Nicola Leone",PODS '04 Proceedings of the twenty-third ACM SIGMOD-SIGACT-SIGART symposium on Principles of database systems,2004,weighted hypertree decompositions and optimal query plans,francesco scarcello gianluigi greco nicola leone,249
539087d920f70186a0d5ff94,Multi-dimensional resource scheduling for parallel queries,"Minos N. Garofalakis, Yannis E. Ioannidis",SIGMOD '96 Proceedings of the 1996 ACM SIGMOD international conference on Management of data,1996,multi dimensional resource scheduling for parallel queries,minos n garofalakis yannis e ioannidis,854
5390880d20f70186a0d7b5e8,Constraint databases: a tutorial introduction,Jan Van den Bussche,ACM SIGMOD Record,2000,constraint databases a tutorial introduction,jan van den bussche,1565
5390881220f70186a0d7e33c,Kweelt: more than just “yet another framework to query XML!”,Arnaud Sahuguet,SIGMOD '01 Proceedings of the 2001 ACM SIGMOD international conference on Management of data,2001,kweelt more than just yet another framework to query xml,arnaud sahuguet,1680
53908a9620f70186a0da4730,Semantic Access: Semantic Interface for Querying Databases,"Naphtali Rishe, Jun Yuan, Rukshan Athauda, Shu-Ching Chen, Xiaoling Lu, Xiaobin Ma, Alexander Vaschillo, Artyom Shaposhnikov, Dmitry Vasilevsky",VLDB '00 Proceedings of the 26th International Conference on Very Large Data Bases,2000,semantic access semantic interface for querying databases,naphtali rishe jun yuan rukshan athauda shu ching chen xiaoling lu xiaobin ma alexander vaschillo artyom shaposhnikov dmitry vasilevsky,2198
539087f320f70186a0d6f88b,Clustering methods for large databases: from the past to the future,"Alexander Hinneburg, Daniel A. Keim",SIGMOD '99 Proceedings of the 1999 ACM SIGMOD international conference on Management of data,1999,clustering methods for large databases from the past to the future,alexander hinneburg daniel a keim,1348
5590ddbb0cf2ce4b6f3a0979,ACM SIGMOD Record,"Timos Sellis, Sharad Mehrotra",ACM SIGMOD Record,2001,acm sigmod record,timos sellis sharad mehrotra,1705
5390881820f70186a0d81116,Databases and transaction processing: an application-oriented approach,"Philip M. Lewis, Arthur Bernstein, Michael Kifer",ACM SIGMOD Record,2002,databases and transaction processing an application oriented approach,philip m lewis arthur bernstein michael kifer,1736
539087f320f70186a0d70aca,Semantic interoperability in information services: experiencing with CoopWARE,Avigdor Gal,ACM SIGMOD Record,1999,semantic interoperability in information services experiencing with coopware,avigdor gal,1394
5590d1ba0cf2baaad9716ef8,ACM SIGMOD Record,"",ACM SIGMOD Record,2004,acm sigmod record,"",2875
53908b4920f70186a0dbabdf,Delivering presentations from multimedia servers,"Nevzat Hurkan Balkir, Gultekin Ozsoyoglu",The VLDB Journal — The International Journal on Very Large Data Bases,1998,delivering presentations from multimedia servers,nevzat hurkan balkir gultekin ozsoyoglu,2555
5390882420f70186a0d89092,Monadic datalog and the expressive power of languages for web information extraction,"Georg Gottlob, Christoph Koch",Proceedings of the twenty-first ACM SIGMOD-SIGACT-SIGART symposium on Principles of database systems,2002,monadic datalog and the expressive power of languages for web information extraction,georg gottlob christoph koch,1753
5390881220f70186a0d7e337,Dissemination of dynamic data,"Pavan Deolasee, Amol Katkar, Ankur Panchbudhe, Krithi Ramamritham, Prashant Shenoy",SIGMOD '01 Proceedings of the 2001 ACM SIGMOD international conference on Management of data,2001,dissemination of dynamic data,pavan deolasee amol katkar ankur panchbudhe krithi ramamritham prashant shenoy,1682
53909f8c20f70186a0e401cc,Reverse kNN search in arbitrary dimensionality,"Yufei Tao, Dimitris Papadias, Xiang Lian",VLDB '04 Proceedings of the Thirtieth international conference on Very large data bases - Volume 30,2004,reverse knn search in arbitrary dimensionality,yufei tao dimitris papadias xiang lian,546
539087f320f70186a0d6f79d,Rewriting aggregate queries using views,"Sara Cohen, Werner Nutt, Alexander Serebrenik",PODS '99 Proceedings of the eighteenth ACM SIGMOD-SIGACT-SIGART symposium on Principles of database systems,1999,rewriting aggregate queries using views,sara cohen werner nutt alexander serebrenik,1263
539087d420f70186a0d5df47,Efficient maintenance of materialized mediated views,"James J. Lu, Guido Moerkotte, Joachim Schue, V. S. Subrahmanian",SIGMOD '95 Proceedings of the 1995 ACM SIGMOD international conference on Management of data,1995,efficient maintenance of materialized mediated views,james j lu guido moerkotte joachim schue v s subrahmanian,769
539089ab20f70186a0d97055,Data mining-based intrusion detectors: an overview of the columbia IDS project,"Salvatore J. Stolfo, Wenke Lee, Philip K. Chan, Wei Fan, Eleazar Eskin",ACM SIGMOD Record,2001,data mining based intrusion detectors an overview of the columbia ids project,salvatore j stolfo wenke lee philip k chan wei fan eleazar eskin,1919
5390881220f70186a0d7e334,Exploiting constraint-like data characterizations in query optimization,"Parke Godfrey, Jarek Gryz, Calisto Zuzarte",SIGMOD '01 Proceedings of the 2001 ACM SIGMOD international conference on Management of data,2001,exploiting constraint like data characterizations in query optimization,parke godfrey jarek gryz calisto zuzarte,1702
53908a7420f70186a0da45e0,"The New Locking, Logging, and Recovery Architecture of Microsoft SQL Server 7.0",David Campbell,VLDB '99 Proceedings of the 25th International Conference on Very Large Data Bases,1999,the new locking logging and recovery architecture of microsoft sql server 7 0,david campbell,2091
539087f320f70186a0d6f885,"“Honey, I shrunk the database”: footprint, mobility, and beyond",Praveen Seshadri,SIGMOD '99 Proceedings of the 1999 ACM SIGMOD international conference on Management of data,1999,honey i shrunk the database footprint mobility and beyond,praveen seshadri,1352
53908b4920f70186a0dbbf7e,Concise descriptions of subsets of structured sets,"Alberto O. Mendelzon, Ken Q. Pu",Proceedings of the twenty-second ACM SIGMOD-SIGACT-SIGART symposium on Principles of database systems,2003,concise descriptions of subsets of structured sets,alberto o mendelzon ken q pu,2680
5390882d20f70186a0d8db95,Bringing order to query optimization,"Giedrius Slivinskas, Christian S. Jensen, Richard Thomas Snodgrass",ACM SIGMOD Record,2002,bringing order to query optimization,giedrius slivinskas christian s jensen richard thomas snodgrass,1873
539087cf20f70186a0d5d03f,"Replication: DB2, Oracle, or Sybase?",Doug Stacey,ACM SIGMOD Record,1995,replication db2 oracle or sybase,doug stacey,726
53909f6920f70186a0e3a96a,Structural function inlining technique for structurally recursive XML queries,"Chang-Won Park, Jun-Ki Min, Chin-Wan Chung",VLDB '02 Proceedings of the 28th international conference on Very Large Data Bases,2002,structural function inlining technique for structurally recursive xml queries,chang won park jun ki min chin wan chung,281
5590da7c0cf2baaad9717432,Reminiscences on influential papers,Kenneth A. Ross,ACM SIGMOD Record,2004,reminiscences on influential papers,kenneth a ross,215
539087f320f70186a0d70a2a,Semantic integration of semistructured and structured data sources,"S. Bergamaschi, S. Castano, M. Vincini",ACM SIGMOD Record,1999,semantic integration of semistructured and structured data sources,s bergamaschi s castano m vincini,1392
53908a7420f70186a0da4529,On the Discovery of Interesting Patterns in Association Rules,"Sridhar Ramaswamy, Sameer Mahajan, Abraham Silberschatz",VLDB '98 Proceedings of the 24rd International Conference on Very Large Data Bases,1998,on the discovery of interesting patterns in association rules,sridhar ramaswamy sameer mahajan abraham silberschatz,2054
539087dd20f70186a0d64490,Meaningful change detection in structured data,"Sudarshan S. Chawathe, Hector Garcia-Molina",SIGMOD '97 Proceedings of the 1997 ACM SIGMOD international conference on Management of data,1997,meaningful change detection in structured data,sudarshan s chawathe hector garcia molina,954
53908a9620f70186a0da4cf4,A Data Transformation System for Biological Data Sources,"Peter Buneman, Susan B. Davidson, Kyle Hart, G. Christian Overton, Limsoon Wong",VLDB '95 Proceedings of the 21th International Conference on Very Large Data Bases,1995,a data transformation system for biological data sources,peter buneman susan b davidson kyle hart g christian overton limsoon wong,2298
53908a9620f70186a0da47e1,CheeTah: a Lightweight Transaction Server for Plug-and-Play Internet Data Management,"Guy Pardon, Gustavo Alonso",VLDB '00 Proceedings of the 26th International Conference on Very Large Data Bases,2000,cheetah a lightweight transaction server for plug and play internet data management,guy pardon gustavo alonso,2224
53908b4920f70186a0dbc50a,Lineage tracing for general data warehouse transformations,"Y. Cui, J. Widom",The VLDB Journal — The International Journal on Very Large Data Bases,2003,lineage tracing for general data warehouse transformations,y cui j widom,2684
53908a7420f70186a0da4686,Online Feedback for Nested Aggregate Queries with Multi-Threading,"Kian-Lee Tan, Cheng Hian Goh, Beng Chin Ooi",VLDB '99 Proceedings of the 25th International Conference on Very Large Data Bases,1999,online feedback for nested aggregate queries with multi threading,kian lee tan cheng hian goh beng chin ooi,2137
539087d420f70186a0d5df13,A general solution of the n-dimensional B-tree problem,Michael Freeston,SIGMOD '95 Proceedings of the 1995 ACM SIGMOD international conference on Management of data,1995,a general solution of the n dimensional b tree problem,michael freeston,750
539087d420f70186a0d5df6b,The Algres testbed of CHIMERA: an active object-oriented database system,"Stefano Ceri, Piero Fraternali, Stefano Paraboschi, Giuseppe Psaila",SIGMOD '95 Proceedings of the 1995 ACM SIGMOD international conference on Management of data,1995,the algres testbed of chimera an active object oriented database system,stefano ceri piero fraternali stefano paraboschi giuseppe psaila,805
53908a9620f70186a0da4e2d,Using Referential Integrity To Easily Define Consistent Subset Replicas,Brad Hammond,VLDB '96 Proceedings of the 22th International Conference on Very Large Data Bases,1996,using referential integrity to easily define consistent subset replicas,brad hammond,2343
53908b4920f70186a0dbbf7b,Data exchange: getting to the core,"Ronald Fagin, Phokion G. Kolaitis, Lucian Popa",Proceedings of the twenty-second ACM SIGMOD-SIGACT-SIGART symposium on Principles of database systems,2003,data exchange getting to the core,ronald fagin phokion g kolaitis lucian popa,2664
539087d420f70186a0d5df60,Enterprise Objects Framework: a second generation object-relational enabler,Charly Kleissner,SIGMOD '95 Proceedings of the 1995 ACM SIGMOD international conference on Management of data,1995,enterprise objects framework a second generation object relational enabler,charly kleissner,793
5390882d20f70186a0d8dac2,General match: a subsequence matching method in time-series databases based on generalized windows,"Yang-Sae Moon, Kyu-Young Whang, Wook-Shin Han",Proceedings of the 2002 ACM SIGMOD international conference on Management of data,2002,general match a subsequence matching method in time series databases based on generalized windows,yang sae moon kyu young whang wook shin han,1823
5390880220f70186a0d75f20,Congressional samples for approximate answering of group-by queries,"Swarup Acharya, Phillip B. Gibbons, Viswanath Poosala",SIGMOD '00 Proceedings of the 2000 ACM SIGMOD international conference on Management of data,2000,congressional samples for approximate answering of group by queries,swarup acharya phillip b gibbons viswanath poosala,1496
5390958920f70186a0deec75,Exposing undergraduate students to database system internals,"Anastassia Ailamaki, Joseph M. Hellerstein",ACM SIGMOD Record,2003,exposing undergraduate students to database system internals,anastassia ailamaki joseph m hellerstein,2822
539089ab20f70186a0d96f5b,XML document versioning,"Shu Yao Chien, Vassilis J. Tsotras, Carlo Zaniolo",ACM SIGMOD Record,2001,xml document versioning,shu yao chien vassilis j tsotras carlo zaniolo,1903
53909f8c20f70186a0e3fe25,The history of histograms (abridged),Yannis Ioannidis,VLDB '03 Proceedings of the 29th international conference on Very large data bases - Volume 29,2003,the history of histograms abridged,yannis ioannidis,406
53909f8c20f70186a0e40200,GPX: interactive mining of gene expression data,"Daxin Jiang, Jian Pei, Aidong Zhang",VLDB '04 Proceedings of the Thirtieth international conference on Very large data bases - Volume 30,2004,gpx interactive mining of gene expression data,daxin jiang jian pei aidong zhang,633
539087d420f70186a0d5df3f,Applying update streams in a soft real-time database system,"B. Adelberg, H. Garcia-Molina, B. Kao",SIGMOD '95 Proceedings of the 1995 ACM SIGMOD international conference on Management of data,1995,applying update streams in a soft real time database system,b adelberg h garcia molina b kao,765
53908a9620f70186a0da4cfd,A Cost Model for Clustered Object-Oriented Databases,"Georges Gardarin, Jean-Robert Gruser, Zhao-Hui Tang",VLDB '95 Proceedings of the 21th International Conference on Very Large Data Bases,1995,a cost model for clustered object oriented databases,georges gardarin jean robert gruser zhao hui tang,2310
53908a7420f70186a0da45e3,Quality-driven Integration of Heterogenous Information Systems,"Felix Naumann, Ulf Leser, Johann Christoph Freytag",VLDB '99 Proceedings of the 25th International Conference on Very Large Data Bases,1999,quality driven integration of heterogenous information systems,felix naumann ulf leser johann christoph freytag,2101
539087dd20f70186a0d644f7,"Object-relational database systems (tutorial): principles, products and challenges","Michael J. Carey, Nelson M. Mattos, Anil K. Nori",SIGMOD '97 Proceedings of the 1997 ACM SIGMOD international conference on Management of data,1997,object relational database systems tutorial principles products and challenges,michael j carey nelson m mattos anil k nori,994
558cf655e4b00b95a766fe42,ACM SIGMOD Record,"Sudha Ram, Joan M. Peckham",ACM SIGMOD Record,1997,acm sigmod record,sudha ram joan m peckham,952
5390975920f70186a0dfe2bb,"\"Review of \"\"Managing gigabytes: compressing and indexing documents and images, by Ian H. Witten, Alistair Moffat, and Timothy C. Bell\"\" Morgan Kauffman, 1999, 519 pp. ISBN 1558605703.\"",S. V. Nagaraj,ACM SIGMOD Record,2004,review of managing gigabytes compressing and indexing documents and images by ian h witten alistair moffat and timothy c bell morgan kauffman 1999 519 pp isbn 1558605703,s v nagaraj,161
