PaperID|Title|Authors|Venue|Year
53e9b049b7602d9703aab656|Maintenance of Automatic Summary Tables.|Wolfgang Lehner, Richard Sidle, Hamid Pirahesh, Roberta Cochrane|SIGMOD Conference|2000
53e9bd1eb7602d97049a97eb|Web caching for database applications with Oracle Web Cache.|Jesse Anton, Lawrence Jacobs, Xiang Liu, Jordan Parker, Zheng Zeng, Tie Zhong|SIGMOD Conference|2002
53e9b5a2b7602d97040ea267|The Data That You Won't Find in Databases: Tutorial panel on data exchange formats.|Peter Buneman, David Maier|SIGMOD Conference|1995
53e9a894b7602d97031e356c|Enhanced Hypertext Categorization Using Hyperlinks.|Soumen Chakrabarti, Byron Dom, Piotr Indyk|SIGMOD Conference|1998
53e9b1c3b7602d9703c53a60|D(k)-Index: An Adaptive Structural Summary for Graph-Structured Data.|Chen Qun, Andrew Lim, Kian Win Ong|SIGMOD Conference|2003
53e9990db7602d9702148696|``Honey, I Shrunk the DBMS'': Footprint, Mobility, and Beyond (Panel).|Praveen Seshadri|SIGMOD Conference|1999
53e9a824b7602d970316ca62|Gangam - A Solution to Support Multiple Data Models, their Mappings and Maintenance.|Kajal T. Claypool, Elke A. Rundensteiner, Xin Zhang 0002, Hong Su, Harumi A. Kuno, Wang-Chien Lee, Gail Mitchell|SIGMOD Conference|2001
53e99f11b7602d97027deea2|Extracting Structured Data from Web Pages.|Arvind Arasu, Hector Garcia-Molina|SIGMOD Conference|2003
53e9a91ab7602d970326be48|Holistic UDAFs at streaming speeds.|Graham Cormode, Theodore Johnson, Flip Korn, S. Muthukrishnan, Oliver Spatscheck, Divesh Srivastava|SIGMOD Conference|2004
53e99fd0b7602d97028aed9b|Support for Relaxed Currency and Consistency Constraints in MTCache.|Hongfei Guo, Per-Åke Larson, Raghu Ramakrishnan, Jonathan Goldstein|SIGMOD Conference|2004
53e9a789b7602d97030c3360|SoundCompass: A Practical Query-by-Humming System.|Naoko Kosugi, Yasushi Sakurai, Masashi Morimoto|SIGMOD Conference|2004
53e9b923b7602d970450eb39|BLAS: An Efficient XPath Processing System.|Yi Chen 0001, Susan B. Davidson, Yifeng Zheng|SIGMOD Conference|2004
53e9a675b7602d9702fa8dac|Compressing Historical Information in Sensor Networks.|Antonios Deligiannakis, Yannis Kotidis, Nick Roussopoulos|SIGMOD Conference|2004
53e99a35b7602d97022963e6|Lazy Query Evaluation for Active XML.|Serge Abiteboul, Omar Benjelloun, Bogdan Cautis, Ioana Manolescu, Tova Milo, Nicoleta Preda|SIGMOD Conference|2004
53e9b8ccb7602d97044aba70|Dynamic XML documents with distribution and replication.|Serge Abiteboul, Angela Bonifati, Gregory Cobena, Ioana Manolescu, Tova Milo|SIGMOD Conference|2003
53e9acd3b7602d97036b13fd|A Comprehensive XQuery to SQL Translation using Dynamic Interval Encoding.|David DeHaan, David Toman, Mariano P. Consens, M. Tamer Özsu|SIGMOD Conference|2003
53e9b550b7602d9704086a53|Query Optimization at the Crossroads (Panel).|Surajit Chaudhuri|SIGMOD Conference|1997
53e9bb23b7602d970475d139|ToXgene: a template-based data generator for XML.|Denilson Barbosa, Alberto O. Mendelzon, John Keenleyside, Kelly A. Lyons|SIGMOD Conference|2002
53e9be4ab7602d9704b05415|Database tuning: principles, experiments, and troubleshooting techniques (part I).|Dennis Shasha, Philippe Bonnet|SIGMOD Conference|2002
53e9aeddb7602d970390946d|Oracle RAC: Architecture and Performance.|Angelo Pruscino|SIGMOD Conference|2003
53e9983db7602d9702063c27|Online Query Processing.|Peter J. Haas, Joseph M. Hellerstein|SIGMOD Conference|2001
53e9b290b7602d9703d35bc3|Developing a High Traffic, Read-Only Web Site.|John Nauman, Ray Suorsa|SIGMOD Conference|1998
53e99c12b7602d97024c0b38|FlowBack: Providing Backward Recovery for Workflow Systems.|Bartek Kiepuszewski, Ralf Mühlberger, Maria E. Orlowska|SIGMOD Conference|1998
53e9ba6ab7602d970468d643|Tools for Design of Composite Web Services.|Richard Hull, Jianwen Su|SIGMOD Conference|2004
53e9a3c7b7602d9702cd90f5|Storing and querying ordered XML using a relational database system.|Igor Tatarinov, Stratis Viglas, Kevin S. Beyer, Jayavel Shanmugasundaram, Eugene J. Shekita, Chun Zhang|SIGMOD Conference|2002
53e9aeeab7602d970391410b|IrisNet: Internet-scale Resource-Intensive Sensor Services.|Amol Deshpande, Suman Nath, Phillip B. Gibbons, Srinivasan Seshan|SIGMOD Conference|2003
53e9b84ab7602d970440e66e|Estimating Progress of Long Running SQL Queries.|Surajit Chaudhuri, Vivek R. Narasayya, Ravishankar Ramamurthy|SIGMOD Conference|2004
53e99cc9b7602d970257be45|SINA: Scalable Incremental Processing of Continuous Queries in Spatio-temporal Databases.|Mohamed F. Mokbel, Xiaopeng Xiong, Walid G. Aref|SIGMOD Conference|2004
53e9b160b7602d9703be66bc|Querying Structured Text in an XML Database.|Shurug Al-Khalifa, Cong Yu, H. V. Jagadish|SIGMOD Conference|2003
53e9bc9db7602d9704919f89|A Database Approach to Quality of Service Specification in Video Databases.|Elisa Bertino, Ahmed K. Elmagarmid, Mohand-Said Hacid|SIGMOD Record|2003
53e9ab64b7602d97034fd41b|An Ultra Highly Available DBMS.|Svein-Olaf Hvasshovd, Svein Erik Bratsberg, Øystein Torbjørnsen|VLDB|2000
53e9a46ab7602d9702d8625e|Cache Coherency in Oracle Parallel Server.|Boris Klots|VLDB|1996
53e9985fb7602d9702096b4f|Resource Scheduling for Composite Multimedia Objects.|Minos N. Garofalakis, Yannis E. Ioannidis, Banu Özden|VLDB|1998
53e9bb8cb7602d97047d0475|Using Versions in Update Transactions: Application to Integrity Checking.|François Llirbat, Eric Simon, Dimitri Tombroff|VLDB|1997
53e9ad72b7602d970375ed6d|Incremental Organization for Data Recording and Warehousing.|H. V. Jagadish, P. P. S. Narayan, S. Seshadri, S. Sudarshan 0001, Rama Kanneganti|VLDB|1997
53e9bcefb7602d9704975d7f|Integrating Information for On Demand Computing.|Nelson Mendonça Mattos|VLDB|2003
53e9ae22b7602d97038361b6|GPX: Interactive Mining of Gene Expression Data.|Daxin Jiang, Jian Pei, Aidong Zhang|VLDB|2004
53e9b802b7602d97043b82e0|Privacy-Enhanced Data Management for Next-Generation e-Commerce.|Chris Clifton, Irini Fundulaki, Richard Hull, Bharat Kumar, Daniel F. Lieuwen, Arnaud Sahuguet|VLDB|2003
53e9a9beb7602d970331dd27|Reverse kNN Search in Arbitrary Dimensionality.|Yufei Tao, Dimitris Papadias, Xiang Lian|VLDB|2004
53e9a52cb7602d9702e4eaeb|Chip-Secured Data Access: Reconciling Access Rights with Data Encryption.|Luc Bouganim, François Dang Ngoc, Philippe Pucheral, Lilan Wu|VLDB|2003
53e9b98ab7602d970457bd03|Modeling Skewed Distribution Using Multifractals and the `80-20' Law.|Christos Faloutsos, Yossi Matias, Abraham Silberschatz|VLDB|1996
53e9bd38b7602d97049c42b1|On Efficiently Implementing SchemaSQL on an SQL Database System.|Laks V. S. Lakshmanan, Fereidoon Sadri, Subbu N. Subramanian|VLDB|1999
53e9a058b7602d970293c070|Panel: Is Generic Metadata Management Feasible?|Philip A. Bernstein, Laura M. Haas, Matthias Jarke, Erhard Rahm, Gio Wiederhold|VLDB|2000
53e9b40eb7602d9703f04482|A Performance Study of Workfile Disk Management for Concurrent Mergesorts in a Multiprocessor Database System.|Kun-Lung Wu, Philip S. Yu, Jen-Yao Chung, James Z. Teng|VLDB|1995
53e9af68b7602d97039adb00|DMS: A Parallel Data Mining Server.|Felicity A. W. George|VLDB|1998
53e9afb3b7602d97039ff677|Don't Scrap It, Wrap It! A Wrapper Architecture for Legacy Data Sources.|Mary Tork Roth, Peter M. Schwarz|VLDB|1997
53e9a9f7b7602d970335ee05|TOPAZ: a Cost-Based, Rule-Driven, Multi-Phase Parallelizer.|Clara Nippl, Bernhard Mitschang|VLDB|1998
53e9b634b7602d9704191ccd|Sybase IQ Multiplex - Designed For Analytics.|Roger MacNicol, Blaine French|VLDB|2004
53e9a635b7602d9702f61c6d|Starting (and Sometimes Ending) a Database Company.|Jack A. Orenstein|VLDB|1998
53e9aeebb7602d970391916a|Database De-Centralization - A Practical Approach.|Tor Didriksen, César A. Galindo-Legaria, Eirik Dahle|VLDB|1995
53e9a381b7602d9702c92d6e|Algorithms for Materialized View Design in Data Warehousing Environment.|Jian Yang, Kamalakar Karlapalem, Qing Li|VLDB|1997
53e9a749b7602d9703081985|The Double Life of the Transaction Abstraction: Fundamental Principle and Evolving System Concept.|Henry F. Korth|VLDB|1995
53e9a1fab7602d9702afc679|Schema-driven Customization of Web Services.|Serge Abiteboul, Bernd Amann, Jérôme Baumgarten, Omar Benjelloun, Frederic Dang Ngoc, Tova Milo|VLDB|2003
53e9bb4bb7602d97047886bd|Structural Function Inlining Technique for Structurally Recursive XML Queries.|Chang-Won Park, Jun-Ki Min, Chin-Wan Chung|VLDB|2002
53e9adffb7602d9703807c1b|SVT: Schema Validation Tool for Microsoft SQL-Server.|Ernest Teniente, Carles Farré, Toni Urpí, Carlos Beltrán, David Gañán|VLDB|2004
53e9a86fb7602d97031ba896|E.piphany Epicenter Technology Overview.|Sridhar Ramaswamy|VLDB|2000
53e9b0dfb7602d9703b5cb15|A Logical Framework for Scheduling Workflows under Resource Allocation Constraints.|Pinar Senkul, Michael Kifer, Ismail Hakki Toroslu|VLDB|2002
53e9b9dab7602d97045d3160|Using Probabilistic Information in Data Integration.|Daniela Florescu, Daphne Koller, Alon Y. Levy|VLDB|1997
53e9b746b7602d97042e000e|R-Tree Based Indexing of Now-Relative Bitemporal Data.|Rasa Bliujute, Christian S. Jensen, Simonas Saltenis, Giedrius Slivinskas|VLDB|1998
53e9a767b7602d97030a3080|REFEREE: An Open Framework for Practical Testing of Recommender Systems using ResearchIndex.|Dan Cosley, Steve Lawrence, David M. Pennock|VLDB|2002
53e9b12ab7602d9703bacfb7|A Raster Approximation For Processing of Spatial Joins.|Geraldo Zimbrao, Jano Moreira de Souza|VLDB|1998
53e9a50fb7602d9702e3050d|Matching Database Access Patterns to Storage Characteristics.|Jiri Schindler|VLDB PhD Workshop|2003
53e9a4b8b7602d9702dd5e3b|Materialized View Selection for Multidimensional Datasets.|Amit Shukla, Prasad Deshpande, Jeffrey F. Naughton|VLDB|1998
53e9b885b7602d9704459d5f|An Evaluation of Generic Bulk Loading Techniques.|Jochen Van den Bercken, Bernhard Seeger|VLDB|2001
53e9b867b7602d97044340d8|A Comparative Study of Alternative Middle Tier Caching Solutions to Support Dynamic Web Content Acceleration.|Anindya Datta, Kaushik Dutta, Helen M. Thomas, Debra E. VanderMeer, Krithi Ramamritham, Dan Fishman|VLDB|2001
53e9990db7602d970214d36a|Answering Queries with Aggregation Using Views.|Divesh Srivastava, Shaul Dar, H. V. Jagadish, Alon Y. Levy|VLDB|1996
53e9a051b7602d970293978d|Biodiversity Informatics: The Challenge of Rapid Development, Large Databases, and Complex Data (Keynote).|Meridith A. Lane, James L. Edwards, Ebbe Nielsen|VLDB|2000
53e9b52db7602d970406711c|StreamMiner: A Classifier Ensemble-based Engine to Mine Concept-drifting Data Streams.|Wei Fan|VLDB|2004
53e9a7bab7602d97030f60ad|Large Databases for Remote Sensing and GIS.|A. R. Dasgupta|VLDB|1996
53e9aa32b7602d97033a1147|A Practical and Modular Implementation of Extended Transaction Models.|Roger S. Barga, Calton Pu|VLDB|1995
53e9a13fb7602d9702a33280|Staircase Join: Teach a Relational DBMS to Watch its (Axis) Steps.|Torsten Grust, Maurice van Keulen, Jens Teubner|VLDB|2003
53e9ba70b7602d97046950d3|Building Light-Weight Wrappers for Legacy Web Data-Sources Using W4F.|Arnaud Sahuguet, Fabien Azavant|VLDB|1999
53e9bb0fb7602d97047483c7|Publish/Subscribe on the Web at Extreme Speed.|João Pereira, Françoise Fabret, François Llirbat, Radu Preotiuc-Pietro, Kenneth A. Ross, Dennis Shasha|VLDB|2000
53e9986eb7602d97020ac05e|AniPQO: Almost Non-intrusive Parametric Query Optimization for Nonlinear Cost Functions.|Arvind Hulgeri, S. Sudarshan 0001|VLDB|2003
53e9b9adb7602d970459fb53|KODA - The Architecture And Interface of a Data Model Independent Kernel.|Gopalan Arun, Ashok Joshi|VLDB|1998
53e9bb3db7602d9704779b65|QUIET: Continuous Query-driven Index Tuning.|Kai-Uwe Sattler, Ingolf Geist, Eike Schallehn|VLDB|2003
53e9a658b7602d9702f8c37c|The Changing Landscape of the Software Industry and its Implications for India|Umang Gupta|VLDB|1996
53e9aed1b7602d97038fa413|ProTDB: Probabilistic Data in XML.|Andrew Nierman, H. V. Jagadish|VLDB|2002
53e9b19cb7602d9703c2527c|The Data-Centric Revolution in Networking.|Scott Shenker|VLDB|2003
53e9b641b7602d970419d437|Efficient Approximation Of Optimization Queries Under Parametric Aggregation Constraints.|Sudipto Guha, Dimitrios Gunopulos, Nick Koudas, Divesh Srivastava, Michail Vlachos|VLDB|2003
53e9b607b7602d970415bd12|Novel Approaches in Query Processing for Moving Object Trajectories.|Dieter Pfoser, Christian S. Jensen, Yannis Theodoridis|VLDB|2000
53e99beab7602d9702493846|Wireless Graffiti - Data, Data Everywhere Matters.|Tomasz Imielinski, B. R. Badrinath|VLDB|2002
53e9b929b7602d970451535e|Avoiding Ordering and Grouping In Query Processing.|Xiaoyu Wang, Mitch Cherniack|VLDB|2003
53e9b0c2b7602d9703b34a47|WIC: A General-Purpose Algorithm for Monitoring Web Information Sources.|Sandeep Pandey, Kedar Dhamdhere, Christopher Olston|VLDB|2004
53e99a78b7602d97022e901f|NESTREAM: Querying Nested Streams.|Damianos Chatziantoniou, Achilleas Anagnostopoulos|SIGMOD Record|2004
53e9aeebb7602d9703917def|Optimization of Data Stream Processing.|Janusz R. Getta, Ehsan Vossough|SIGMOD Record|2004
53e9b2f9b7602d9703db8ef9|Digital Library Services in Mobile Computing.|Bharat K. Bhargava, Melliyal Annamalai, Evaggelia Pitoura|SIGMOD Record|1995
53e997b9b7602d9701f9d978|Information rules.|Dale A. Stirling|SIGMOD Record|2003
53e9a36db7602d9702c77750|Semistructured und Structured Data in the Web: Going Back and Forth.|Paolo Atzeni, Giansalvatore Mecca, Paolo Merialdo|SIGMOD Record|1997
53e9b40eb7602d9703f006b9|Semantic Integration of Semistructured and Structured Data Sources.|Sonia Bergamaschi, Silvana Castano, Maurizio Vincini|SIGMOD Record|1999
53e99800b7602d970200b603|Editor's Notes.|Ling Liu|SIGMOD Record|2002
53e99800b7602d970200b5fd|Editor's Notes.|Michael J. Franklin|SIGMOD Record|1998
53e9bd1db7602d97049a50d0|Foundations of Statistical Natural Language Processing - Book Review.|Gerhard Weikum|SIGMOD Record|2002
53e9a480b7602d9702d9b138|SQL: 1999, formerly known as SQL 3.|Andrew Eisenberg, Jim Melton|SIGMOD Record|1999
53e99a3cb7602d9702299fe9|The p Operator: Discovering and Ranking Associations on the Semantic Web.|Kemafor Anyanwu, Amit P. Sheth|SIGMOD Record|2002
53e9aa2cb7602d970339bf14|FinTime - A Financial Time Series Benchmark.|Kaippallimalil J. Jacob, Dennis Shasha|SIGMOD Record|1999
53e99d58b7602d9702613e02|Workshop Report on Experiences Using Object Data Management in the Real-World.|Akmal B. Chaudhri|SIGMOD Record|1998
53e9afeeb7602d9703a429c6|The Asilomar Report on Database Research.|Philip A. Bernstein, Michael L. Brodie, Stefano Ceri, David J. DeWitt, Michael J. Franklin, Hector Garcia-Molina, Jim Gray, Gerald Held, Joseph M. Hellerstein, H. V. Jagadish, Michael Lesk, David Maier, Jeffrey F. Naughton, Hamid Pirahesh, Michael Stonebraker, Jeffrey D. Ullman|SIGMOD Record|1998
53e9a52cb7602d9702e5083b|Towards On-Line Analytical Mining in Large Databases.|Jiawei Han|SIGMOD Record|1998
53e99800b7602d970200b604|Editor's Notes.|Ling Liu|SIGMOD Record|2003
53e99afeb7602d970238d25a|Reconsidering Multi-Dimensional schemas.|Tim Martyn|SIGMOD Record|2004
53e99809b7602d970201f8e3|Chair's Message.|Richard T. Snodgrass|SIGMOD Record|1998
53e9a7c1b7602d9703101656|Report on the 24th European Colloquium on Information Retrieval Research.|Fabio Crestani, Mark Girolami|SIGMOD Record|2002
53e9a31eb7602d9702c266ab|Parameterized Complexity for the Database Theorist.|Martin Grohe|SIGMOD Record|2002
53e99800b7602d970200b5fd|Editor's Notes.|Michael J. Franklin|SIGMOD Record|1998
53e9b2dbb7602d9703d91bc7|EDBT04 Workshop on Database Technologies for Handling XML Information on the Web.|Marco Mesiti, Barbara Catania, Giovanna Guerrini, Akmal B. Chaudhri|SIGMOD Record|2004
53e9a699b7602d9702fcd165|Predator: A Resource for Database Research.|Praveen Seshadri|SIGMOD Record|1998
53e9ad68b7602d970374f0fd|Reasoning on regular path queries.|Diego Calvanese, Giuseppe De Giacomo, Maurizio Lenzerini, Moshe Y. Vardi|SIGMOD Record|2003
53e99800b7602d970200b60a|Editor's Notes.|Ling Liu|SIGMOD Record|2003
53e9aa66b7602d97033d942d|Database Research at the University of Oklahoma.|Le Gruenwald, Leonard Brown, Ravi A. Dirckze, Sylvain Guinepain, Carlos Sánchez, Brian Summers, Sirirut Vanichayobon|SIGMOD Record|1999
53e9ac28b7602d97035ed764|Calls for Papers and Announcements.||SIGMOD Record|1995
53e99800b7602d970200b5fd|Editor's Notes.|Michael J. Franklin|SIGMOD Record|1998
53e99d96b7602d9702655648|A Conceptual Architecture for Semantic Web Enabled Web Services.|Christoph Bussler, Dieter Fensel, Alexander Maedche|SIGMOD Record|2002
53e9b33db7602d9703e0f3ee|Research Issues in Federated Database Systems: Report of EFDBS '97 Workshop.|Stefan Conrad, Barry Eaglestone, Wilhelm Hasselbring, Mark Roantree, Fèlix Saltor, Martin Schönhoff, Markus Strässler, Mark W. W. Vermeer|SIGMOD Record|1997
53e9a61fb7602d9702f4b489|First-Class Views: A Key to User-Centered Computing.|Arnon Rosenthal, Edward Sciore|SIGMOD Record|1999
53e99a0eb7602d970225f6a1|Bluetooth-based sensor networks.|Philippe Bonnet, Allan Beaufour, Mads Bondo Dydensborg, Martin Leopold|SIGMOD Record|2003
53e9adcdb7602d97037d291a|The Database Group at National Technical University of Athens (NTUA).|Timos K. Sellis, Yannis Vassiliou|SIGMOD Record|1995
53e9a67cb7602d9702fae348|The Five-Minute Rule Ten Years Later, and Other Computer Storage Rules of Thumb.|Jim Gray, Goetz Graefe|SIGMOD Record|1997
53e9a38fb7602d9702ca038a|Changes to the ACM TODS Editorial Board.|Richard T. Snodgrass|SIGMOD Record|2004
53e9b388b7602d9703e6a0ee|Supporting Global User Profiles Through Trusted Authorities.|Ibrahim Cingil|SIGMOD Record|2002
53e9b587b7602d97040c8e5d|Information integration on the Web: a view from AI and databases (report on IIWeb-03).|Subbarao Kambhampati, Craig A. Knoblock|SIGMOD Record|2003
53e9b550b7602d970408b42c|Agent-Oriented software engineering report on the 4th AOSE workshop (AOSE 2003).|Paolo Giorgini|SIGMOD Record|2003
53e9ade2b7602d97037ec4ae|Repositories and Object Oriented Databases.|Philip A. Bernstein|SIGMOD Record|1998
53e997b5b7602d9701f96d88|Journal relevance.|Richard T. Snodgrass|SIGMOD Record|2003
53e99b0ab7602d970239c211|Reminiscences on Influential Papers.|Kenneth A. Ross, Frank Neven, Beng Chin Ooi|SIGMOD Record|2003
53e9ac7bb7602d97036524b7|Continuous Queries over Data Streams.|Shivnath Babu, Jennifer Widom|SIGMOD Record|2001
53e9bb08b7602d97047405ad|The Cougar Project: a work-in-progress report.|Alan J. Demers, Johannes Gehrke, Rajmohan Rajaraman, Agathoniki Trigoni, Yong Yao|SIGMOD Record|2003
53e99809b7602d970201f8e3|Chair's Message.|Richard T. Snodgrass|SIGMOD Record|1999
53e9b46fb7602d9703f703d9|Data Analysis and Mining in the Life Sciences.|Nam Huyn|SIGMOD Record|2001
53e9984fb7602d970208510b|Treasurer's Message.|Joachim Hammer|SIGMOD Record|2001
53e9a839b7602d970318585a|Improving Access to Environmental Data Using Context Information.|Anthony Tomasic, Eric Simon|SIGMOD Record|1997
53e9aa1db7602d970338abf3|Hector Garcia-Molina Speaks Out.|Marianne Winslett|SIGMOD Record|2002
53e9ba65b7602d9704683904|Multi-Table Joins Through Bitmapped Join Indices.|Patrick E. O'Neil, Goetz Graefe|SIGMOD Record|1995
53e9ab48b7602d97034d8db1|A Query Language for a Web-Site Management System.|Mary F. Fernandez, Daniela Florescu, Alon Y. Levy, Dan Suciu|SIGMOD Record|1997
53e99cd1b7602d9702583fd1|An Annotated Bibliography on Real-Time Database Systems.|Özgür Ulusoy|SIGMOD Record|1995
53e9af68b7602d97039ab743|Letter to SIGMOD Record Editor.|Nazih Elderini|SIGMOD Record|2002
53e99f35b7602d9702805451|Real-Time Database - Similarity Semantics and Resource Scheduling.|Tei-Wei Kuo, Aloysius K. Mok|SIGMOD Record|1996
53e9a5beb7602d9702ee5180|Semantic Web Workshop: Models, Architectures and Management.|Panos Constantopoulos, Vassilis Christophides, Dimitris Plexousakis|SIGMOD Record|2001
53e9b6abb7602d970422aac5|Preservation of Digital Data with Self-Validating, Self-Instantiating Knowledge-Based Archives.|Bertram Ludäscher, Richard Marciano, Reagan Moore|SIGMOD Record|2001
53e9a1d0b7602d9702acbf58|An Annotated Bibliography on Active Databases.|Ulrike Jaeger, Johann Christoph Freytag|SIGMOD Record|1995
53e9b6bfb7602d97042462bd|Querying Multiple Bioinformatics Data Sources: Can Semantic Web Research Help?|David Buttler, Matthew Coleman, Terence Critchlow, Renato Fileto, Wei Han, Ling Liu, Calton Pu, Daniel Rocco, Li Xiong|SIGMOD Record|2002
53e99813b7602d970202b96d|Describing Semistructured Data.|Luca Cardelli|SIGMOD Record|2001
53e99e78b7602d970273a433|Report on the 13th Brazilian Symposium on Database Systems (SBBD'98).|Mario A. Nascimento, Claudia Bauzer Medeiros|SIGMOD Record|1999
53e9b88bb7602d970445ea97|Design and Management of Data Warehouses: Report on the DMDW'99 Workshop.|Stella Gatziu, Manfred A. Jeusfeld, Martin Staudt, Yannis Vassiliou|SIGMOD Record|1999
53e9b9a0b7602d970459057d|Report on the 8th International Workshop on Knowledge Representation Meets Databases (KRDB).|Maurizio Lenzerini, Daniele Nardi, Werner Nutt, Dan Suciu|SIGMOD Record|2001
53e9a995b7602d97032f0f99|New Standard for Stored Procedures in SQL.|Andrew Eisenberg|SIGMOD Record|1996
53e9b87fb7602d97044516f7|Understanding the semantics of sensor data.|Murali Mani|SIGMOD Record|2003
53e9a839b7602d97031824c6|P-Grid: a self-organizing structured P2P system.|Karl Aberer, Philippe Cudré-Mauroux, Anwitaman Datta, Zoran Despotovic, Manfred Hauswirth, Magdalena Punceva, Roman Schmidt|SIGMOD Record|2003
53e9a7eab7602d97031283f1|Closing the key loophole in MLS databases.|Nenad Jukic, Svetlozar Nestorov, Susan V. Vrbsky|SIGMOD Record|2003
53e9a727b7602d970305e97a|Research Activities in Database Management and Information Retrieval at the University of Illinois at Chicago.|Isabel F. Cruz, Ashfaq A. Khokhar, Bing Liu 0001, A. Prasad Sistla, Ouri Wolfson, Clement T. Yu|SIGMOD Record|2002
53e9a9f7b7602d970335efd0|Extracting Entity Profiles from Semistructured Information Spaces.|Robert A. Nado, Scott B. Huffman|SIGMOD Record|1997
53e9aed7b7602d970390222a|Where Will Object Techonology Drive Data Administration?|Arnon Rosenthal|SIGMOD Record|1998
53e9abcfb7602d97035851ff|Towards Adaptive Workflow Systems, CSCW-98 Workshop Report.|Abraham Bernstein, Chrysanthos Dellarocas, Mark Klein|SIGMOD Record|1999
53e99bc6b7602d970246db8f|Generating Spatiotemporal Datasets on the WWW.|Yannis Theodoridis, Mario A. Nascimento|SIGMOD Record|2000
53e99a74b7602d97022e39e2|Normalization in OODB Design.|Byung Suk Lee|SIGMOD Record|1995
53e9addab7602d97037e07d4|Management of Data and Services in the Environmental Information System (UIS) of Baden-Württemberg.|Wolf-Fritz Riekert, Roland Mayer-Föll, Gerlinde Wiest|SIGMOD Record|1997
53e9ab42b7602d97034d4ff3|An Active Functionality Service for E-Business Applications.|Mariano Cilia, Alejandro P. Buchmann|SIGMOD Record|2002
53e9a48eb7602d9702daf1eb|The hyperion project: from data integration to data coordination.|Marcelo Arenas, Vasiliki Kantere, Anastasios Kementsietsidis, Iluju Kiringa, Renée J. Miller, John Mylopoulos|SIGMOD Record|2003
53e9a9d9b7602d970333c25d|Research in Information Managment at Dublin City University.|Mark Roantree, Alan F. Smeaton|SIGMOD Record|2002
53e99800b7602d970200b5fd|Editor's Notes.|Michael J. Franklin|SIGMOD Record|1999
53e99809b7602d970201f928|Chair's Message.|M. Tamer Özsu|SIGMOD Record|2004
53e99aa6b7602d970231ea2c|Interview with Rakesh Agrawal.|Marianne Winslett|SIGMOD Record|2003
53e99e54b7602d97027185c1|Workshop on Performance and Architecture of Web Servers (PAWS-2000, held in conjection with SIGMETRICS-2000).|Krishna Kant, Prasant Mohapatra|SIGMOD Record|2000
53e9abe4b7602d970359e217|The Grid: An Application of the Semantic Web.|Carole A. Goble, David De Roure|SIGMOD Record|2002
53e9b55eb7602d9704099d1f|Transactional Information Systems - Book Review.|Marc H. Scholl|SIGMOD Record|2001
53e9ae1cb7602d970382dc4b|Automatic Direct and Indirect Schema Mapping: Experiences and Lessons Learned.|David W. Embley, Li Xu, Yihong Ding|SIGMOD Record|2004
53e9a593b7602d9702eb9db0|DeeDS Towards a Distributed and Active Real-Time Database System.|Sten Andler, Jörgen Hansson, Joakim Eriksson, Jonas Mellin, Mikael Berndtsson, Bengt Eftring|SIGMOD Record|1996
53e9a751b7602d970308c5f4|The Mariposa Distributed Database Management System.|Jeff Sidell|SIGMOD Record|1996
53e9aa73b7602d97033e79bb|Incremental Maintenance of Recursive Views Using Relational Calculus/SQL.|Guozhu Dong, Jianwen Su|SIGMOD Record|2000
53e9be5db7602d9704b1c869|Hierarchies and Relative Operators in the OLAP Environment.|Elaheh Pourabbas, Maurizio Rafanelli|SIGMOD Record|2000
53e9af81b7602d97039c994d|Contextualizing the Information Space in Federated Digital Libraries.|Mike P. Papazoglou, Jeroen Hoppenbrouwers|SIGMOD Record|1999
53e99809b7602d970201f928|Chair's Message|M. Tamer Özsu|SIGMOD Record|2004
53e9a186b7602d9702a7c019|Detection and Classification of Intrusions and Faults using Sequences of System Calls.|João B. D. Cabrera, Lundy M. Lewis, Raman K. Mehra|SIGMOD Record|2001
53e99800b7602d970200b604|Editor's Notes.|Ling Liu|SIGMOD Record|2003
53e9ac89b7602d970365fef8|Design and User Testing of a Multi-Paradigm Query Interface to an Object-Oriented Database.|Dac Khoa Doan, Norman W. Paton, Alistair C. Kilgour|SIGMOD Record|1995
53e9ad18b7602d97036f6d04|Report from the First Workshop on Geo Sensor Networks.|Silvia Nittel, Anthony Stefanidis, Isabel F. Cruz, Max J. Egenhofer, Dina Q. Goldin, A. Howard, Alexandros Labrinidis, Samuel Madden, Agnès Voisard, Michael F. Worboys|SIGMOD Record|2004
53e9ad92b7602d970378f854|Real-Time Index Concurrency Control.|Jayant R. Haritsa, S. Seshadri|SIGMOD Record|1996
53e9b6eeb7602d970428277b|The TriGS Active Object-Oriented Database System - An Overview.|Gerti Kappel, Werner Retschitzegger|SIGMOD Record|1998
53e99a1ab7602d970226c372|Editor's (Farewell) Notes.|Arie Segev|SIGMOD Record|1995
53e99b36b7602d97023d5c86|Pixel-oriented Database Visualizations.|Daniel A. Keim|SIGMOD Record|1996
53e9ba11b7602d970461689e|An Extensible Notation for Spatiotemporal Index Queries.|Vassilis J. Tsotras, Christian S. Jensen, Richard T. Snodgrass|SIGMOD Record|1998
